question,answer
"I still want to get to know, just wondering y u never messaged me back?","which one was yours, and on which app/platform."
what sort of content you thinking about doin?,
what are words?,playful speech-nuggets.
how do you nuke a small country?,believe in yourself.
What do I do to clear my house of invisible crayons?,some people spend their entire lives waiting to be visited by invisible crayons.
"On a scale of 1 to terrible, how terrible do you think wearing socks with sandals is?",it's fine.
How much sleep do you get every night?,"about 0 to 23 hours, on average."
potato.,
Hey so you know those tiny composition books that you can get for like a dollar in a pack of three... Well I bought one and I need ideas for stuff to do with it.. Any suggestions?,try something no one has tried before.
Do you feel like these open questions have corrupted (I use the word v. lightly) your thought patterns at all?,"not any more than it was already corrupted from vine comments, tweets, etc."
do u wanna put ur hands in mud?,"not now, thank you for the opportunity."
what does it take to have a personality?,everything has a personality.
did you have to lift yourself up to drop yourself on your head or did you just go for it?,my mom was carrying me and i jumped.
why don't u play drums in ur music vids (u play rad air drums but just asking)?,"try playing drums in your house or apartment building at 3am (or any time, really) and i think you will understand the problem. unless you live in the desert."
Tips for getting somebody to shut the fuck up?,"take the opportunity to strengthen your focus by attempting to continue doing what you need to do, despite the noise."
can you do a sex tape?,"tape? are you fucking kidding me, what year is it."
do you ever think about how insignificant life on earth is?,compared to what.
Does it bug you when people repeatedly ask when the next history of video is coming out?,"no, i find it pleasant and enjoyable, in addition to being a great source of enrichment on a spiritual and intrapersonal level. it also strengthens my mind and allows me to approach my daily life in a more reasonable and balanced way."
You should do another history video.... Germany? Australia?,
how are u so unique?,i dropped myself on my head when i was young.
Do people ask you to check out their own music?,sometimes.
How do you make good emotional connections with people? I have friends but I don't really like them and I feel like they don't really like me either?,i'm sure you are better at it than me.
So what type of content are you thinking bout doing?,a wider variety than before.
What games do you play?,What The Hell Am I Doing.
"HEY!Like, I didn't wanna write anything, but today was such discoverfull (can I say that?? I'm not from 'round...) day and I wanted to say hi to someone and I found you and then I though I should say something and am now writing and I'm gonna regret it later but I don't care!I'm sorry?",hi.
what is your favorite meme?,social norms.
Ahhhhh? or AHHHHHH? or AH? or ahhh? or ah? or a? or -?,depends on the situation.
do you have a static upload or video creation schedule?,not anymore.
Are you still a piece of Garbage?,
you seem like one of those guys in high school who was in the honor classes but was always sleeping in the corner with hoody up and headphones on?,"almost, but after 9th grade you can't stay in honors classes unless you spend many many hours doing homework, which i was not interested in."
why did the chicken cross the road?,for the fame. here is.
why was your shorty award acceptance speech so simple?,my question would be why were the other ones so complicated.
Is there a way to broaden your vocal range? From what I've heard online the answer is no. But I trust you more.,"not on the low end. but yes on the high end. just do it more, it's like stretching."
"Last night I had a dream you died! I was looking down this very questions page, reading all of the are you gonna do more history of japan-type videos questions and I shed a tear, quietly sobbing that now you never would. I look into the distance thinking that it was such a waste of a talent with so much as-yet untapped potential. Then I was taking away by a dolphin who was whispering that one day we would all join you.","trust me, i'm going to stay on this planet as long as possible. there is an obscene amount of content i have to make."
ok but is it ever really cold in Alabama? 101 degrees certainty isnt?,"that was june 28. i was only there for a week. according to my calculations, in winter it is really nice."
will i ever find love?,probably.
How did you become comfortable with failure?,do it.
what's the hardest instrument you've had to learn to play?,does typing on a smartphone count as an instrument.
Why does your thanks page sya THABK you?,it's my way of putting a creative twist on an old classic.
"I'm afraid of doing because of the possibility of failure, even though ita the building blocks of success. Have you dealt with something like this?",of course. you need to start by failing on purpose. anything successful actually has elements of failure in it. our entire species is a failure. we get old and die. but that doesn't mean it's not also a success.
"I wish I had something clever to say, but I just wanted to ask if it's not too daunting to have to produce content after having such a big viral hit.","the big youtube hit shifted my following. my vine was 10 times bigger than my youtube, now youtube caught up and tripled my vine. so the main shift will be trying to balance long and short content. i think you will see the balance taking shape as these next few videos come out."
do u really exist?,let me check.
you best not be teasing about that new vid?,there will be many. the first one will be the shortest (about 3 seconds). i am trying to get a head start. already almost done with the first 4 videos.
So I think since your not a collaborator I think you should be the leader of a band where you make the music and tell people what to do. Thoughts?,"yes, i agree. i am waiting patiently to reach the point in my career where i have enough money and/or influence to tell a (probably 5 to 10 piece) band what to do."
have you even been to Alabama?,
what is my life?,you know that better than me. especially since you didn't give me any details.
"When learning how to play, was there a certain instrument that you seemed to pick up easier?",drums and piano were the ones that were available.
Are you making an album?,"there will be a few songs individually, then another history video actually."
How do I start doing what I want to do? My body ain't letting me!!,"you are going to have to make a comprimise. once you do that and start moving on a more reasonable path, who knows, your body might become stronger and/or more able to do what it couldn't do before."
"I've had some pretty crazy, slightly traumatic events in my life keep me from being productive and following through on my passions. how do I push through the brain fog and get things done?","what you might not realize is, if everything was going fine it would probably be more difficult to get things done."
when is your next video?,"extremely soon, possibly today."
Do you like all housing architecture styles or do you have a preference?,surprise me.
"for the most part of my life I thought that being excentric was a goal in itself. now I don't believe that anymore, but I cant really stop. what should I do?",just be genuine now. you have already established a built-in uniqueness which is now a part of you.
Why do you love maps? Do you still research them?,
how are you?,good.
everything I've done with music so far has felt like the side project of a primary project I have never done. how to begin on the primary project?,i don't know. i've felt exactly the same way for my entire life. i think i might be starting on the primary project next week.
what's your favorite book?,"Why The World We Live In Is Just Fine, Even If It's Actually Terrible - bob jördelstoan."
"do you play video games?if you do, what's your favorite game, and why?",
"why did you basically reveal where you live bc i know that you live on kosciuszko street which is in brooklyn, nyc.","that was recorded in 2010. it says that in the video. and i was actually living on greene ave. kosciuszko was the nearest train stop, so that's why it came to mind."
Why does your jazz cover of Kings sound nothing like a jazz cover of Kings?,because i did it in nigerian 12/8.
i want to play volleyball but i get really sad and angry with myself everytime i mess up and during games i just start crying a lot. is it worth continuing to pursue something you (mostly) enjoy if you suck at it and can't handle failure?,"yes, absolutely. this is a normal side effect of caring a lot about something. another side effect is you will become really great at it."
favorite soul progression?,does unlocking the secrets of human consciousness count as a soul progression.
What is life?,a logic puzzle.
we have the same name! why do you go by bill instead of william or will?,that would be way too much w.
How do i stop wanting to die?,that's a trick question.
What is perfection?,trying to make something really good.
do you ever rehearse conversations before you have them?,"sometimes, but it doesn't help. you need to do it live."
do you swear at all? i swear too much.,"if by swear you mean say the good words like 'fuck' and 'shit,' then yes."
How to get to new canaan?,that depends where you are now.
can you do more history videos?,
Why am i such a stupid fucking idiot?,does being just fine and on the right track count as being a stupid fucking idiot.
How do i stop being afraid of rejection?,try to find new and interesting ways of being rejected.
when do you sleep?,mainly on mondays and tuesdays.
My bass teacher decided to stop teaching and i don't know if i should continue lessons with someone else. i feel like i'm at a point where i could continue by myself but i don't know if i can do it. i know you're self taught right? Do you have any advice on how to stay motivated?,are you asking me how to want something.
Give me your best answer (in not too many words) for people who go crazy believing everything is a conspiracy. I need that ONE phrase that shuts them up ;-)?,does trying to survive count as a conspiracy.
Do you think one can fall in love via the Internet?,almost.
Favourite Shakespeare play?,the one with all the sin.
would you ever consider having ur body cryogenically frozen? I'm not offering but just wondering?,seems legit.
tips for getting songs unstuck from my head??,listen to a different song.
why am I so depressed?,because everything's too normal.
How do I get motivated to study?,find something you want to study.
Did you do the thing yet?,i started doing it around 2009.
Did you consider making a History of History of Japan video?   Sort of like a behind the scenes video?,"i desperately wish i could do behind the scenes for everything i do, and that's not even the only reason i wish i could live forever."
How do i relax?,stop doing everything else.
is there another country's history that you find extremely interesting?,they are all interesting.
how is the theory more time needs to occur before I know what i am doing holding up?,actually perfectly.
Do sports interest you at all?,does finding your purpose on earth count as a sport.
do you get a lot of marriage proposals?,
"life is uninspiring, and then you die. what makes potatoes so delicious? is it the texture? the taste? the sound? how do you make music with potatoes?",
You can make a lot of money on YouTube with all these views you will get. Why do you instead choose for a pure and calm life without YouTube money?,"monetizing a video means: before you see the video, you have to hear someone talking to you twice is loud in a tone of voice best used on 5-year olds, trying to convince you that you desperately want something you googled 6 months ago."
"in you opinion, do you think people love you just because you won the shorty award and if so, are you annoyed that they love you just because of that?",i think most people haven't actually heard of the shorty awards.
there will be next history of ... wideo?,
"do you think the passage of time is at a constant rate? Because 2016 has felt extremely fast for me and some people I have asked, I wonder if time, which is nonexistent anyway, could perhaps just be flowing faster.",time feels faster as you get older.
any slick vidz in the works?,"i'm glad you asked that, because after spending the last 3 months doing about 300 non-slick vids, i am proud to say that i have returned to slick vids. i have written several, and i am producing them now."
How come I can't go outside without an ad shoved in my face?,"these are relevant product offers for you, based on your behavior, conversations, moods, and thoughts!  please give us your feedback:."
How are you reacting to your sudden increaae in popularity? :^)?,i mainly reacted to it last year. ever since then it has been a gradual increase.
Do you ever wear eyeliner?,no.
Sometimes I wonder if personalities even exist? Like do I even like these things or am I just telling myself I do for the sake of having a clearly defined self? Idk if u get this at all maybe?,"a personality is not what you like, it's what you do. and most people do all different things, so."
have you ever been to kentucky?,i doubt it.
Have any of your fans called you 'dad' yet in a creepy fetishistic manner?,
Why would i want to be myself if i'm a loser?,you are just fine the way you are. whether or not you call that being a loser is your choice.
Have you been outside of the USA? What are some places you want to go?,everywhere.
what are your thoughts on doing a collab video with science?,i don't collaborate.
Did you find the reason to justify your existence?,yes.
what's ur motivation for history of japan?,
do you ever make yourself laugh?,sometimes.
why cant i be a triangle?,"if you want to, you can have some similar characteristics."
Do you miss having a girlfriend/boyfriend?,"yes, but at this point i am really holding out for someone who understands me, and who i understand."
Do you feel like there's certain times of the day when you're more productive?,"between 2am and 6am there are fewer distractions, but it really doesn't matter."
are you real?,i will check.
will you ever create a new video?,i will be making them for the rest of my life.
what if all these questions were asked by one person?,
Do you think death is the only answer?,depends on the question.
do you ever get drunk?,"only for work, sometimes."
What instrument/effect did you use in the Reasons to be King video?,just pulled a clip randomly from the.
"if you were forced to pick some other planet to go to, which one would you pick and why?",there are currently no other inhabitable planets that are less than a lifetime's travel distance away.
why not set the website description to a weird obscure quote from the notebook section?,"i would love to know how to set the description. i have tried, but it doesn't work. anyone who knows please let me know. i want to use something like hi."
Do you like memes?,i used to know what memes are. now i'm not so sure.
Would you date someone like me that's like you?,"if by date you mean make copious amounts of content together, then yes."
"in your lyric section you have a song called 'i'm so shy' but it isn't in your songs section? would really like to hear it, the lyrics are extremely relatable tbh?",it's a total shitpost. probably worse than 'dumpies.' i took it off because it really is terrible.
"im curious and feel free not to answer this, do you wake up and just start working? do other factors like your environment (if the weather is bad or not) affect your workflow?","given the amount of work to do, and that there has been no primary release in 4 months, i really should be doing that. lately it has been difficult. the goal is to be able to work all the time, and i am mostly able to do that. bad weather actually helps, but realistically the weather makes no difference."
would you ever release your music on physical formats like vinyl or cd?,doesn't really seem necessary.
is All U Need Is Love about passion?,"no, it's not really about anything, it was more of a writing exercise. i was very desperate to figure out how to do verse-chorus form. as a result it's probably way too normal."
How does it feel to be such an Eligible Bachelor?,i just looked up what that means and it definitely does not apply to me.
What is your definition of success?,making a huge breakthrough for mankind.
i had a dream that we were dating. is this a sign for something?,"that's weird, i had a date that we were dreaming."
"Do you know your mbti type and dont want to reveal it, or are you just not interested?",it turns out mbti gives you different results depending on how you answer the questions.
How did you learn to sing? Are you self taught or did you ever have a vocal coach? This is coming from someone who is very envious of your vocal control.,"self taught on everything. singing i got into relatively late, after i realized that no one was going to sing my stuff for me. none of the mechanics that teachers talk about made any sense to me, and i took a completely different approach which is probably more similar to acting than singing."
Do you bite your fingernails?,no.
i also play jazz. can you recommend a good jazz album??,do the ever changing dynamics of world geopolitics count as a jazz album.
what is an obscure piece of music theory that has helped you in the past?,bagpipes are annoying. sorry bagpipes.
Who do you admire the most?,you.
"I loved your history of Japan video, it made me not bored and depressed for a few minutes. Is there another history video in the works, and do you plan on becoming a professor?","there actually is another history video coming up, i have already chosen the topic. according to the current schedule, there will be 11 other videos coming out first."
When is your next video coming out?,"extremely soon. it's actually done, but i am waiting to have more done, because the first few will be very short and i don't want people to cry if i only do a short one and then nothing else."
Where do you keep your shorty award. By the way I loved your speech.,"i don't have it. they said they would mail it to me, but i didn't want to give them my address. so they are keeping it in a case for me. i haven't gotten a chance to pick it up."
What does devvo'd mean?,devastated.
"Dear bill, do you exist?",i will check.
Do you consider swearing to be immature?,"if by swearing you mean saying the fun words like 'shit' and 'fuck', then no."
How do you start a band in high school if you have absolutely no friends and everyone thinks you're a freak?,"hi me from the past. i'm glad you found a way to ask yourself questions through time. i know this seems difficult, but this day in age you might be better off trying to do everything yourself. it can be hard work, but there are huge advantages, especially for freaks. you can get extra freaky and no one will stop you."
are you the only child to your parents? Do you have siblings?,i have 1 brother and 2 half brothers.
what is the secret to success?,be ruthlessly yourself.
Will it all be okay?,great question. yes.
"Do you button shirts from the bottom up, or from the top down?","i try to get pre-buttoned shirts, if possible."
Do you reccomend lying on the floor?,"sure, sometimes."
Bill how can I stop being depressed?,get abducted by aliens.
It's hot here. Is it hot where you are?,sort of.
I don't have a group of friends at school. I have scattered friends with other cliques. do you think I should change?,fuck no.
Will you have concerts featuring 11 second songs?,"i think the feature will be longer songs, and there will be shorter ones in between."
You never replied to me email. Devvo'd.,which one was yours.
you seem like an interesting person. have you ever thought uploading vlogs in your channel?,"yes, but i've found what works better for me is to do them privately and edit them years later and post them on the website."
what do you thing about drugs?,does america count as a drug.
When you made all your reality videos did you make them because you thought they might come in handy in the future or did you make them for your own personal ref?,both.
So what's up with all the quotes about leadership etc on your walls? I'm intrigued?,they were there before i moved in.
When are you?,now.
How much wood could a woodchuck chuck if a woodchuck could chuck wood?,
do you like playing drums or do you hate it like a bitter lemon?,i like it but the set up and tear down is a real drag.
how do i stop being sad?,start being something else.
Any tips for composing jazz?And do you enjoy jazz theory?,"i don't compose things aiming to be labeled with a particular genre name. in fact i kind of do the opposite, but i mainly don't worry about it."
"honest question, do you actually enjoy answering these questions or do your fans annoy you sometimes?",both.
how do you motivate yourself to continue living?,there is still a lot of stuff i need to do that i think no one else is going to do.
is it healthy to breathe?,yes.
What if i just stopped?,there would be nothing left to do except start again.
"to be a hero, does there have to be a villain?",does sadness count as a villain.
"How do I begin to learn music theory? I've been playing guitar for 2 years now with absolutely no knowledge of theory, just playing songs I like, having fun with it, but now I'd like to make my own music, and I just don't know where to start. I can't afford a music teacher, I havent found anything useful online either. I could quit worrying about having to learn theory and keep messing around, but I'd like to understand so that I could make something good.","start by learning the how to find the 1 chord, the 4 chord, and the 5 chord, and identifying them in songs you know. after that i can give you another taske."
"I want to make art that connects with people but I don't know how. I don't know why I'm telling you this because  it isn't a question. I'm a painter and I love what I do but I'm afraid nobody else will ever care, or get it, or want to get it, or whatever people do with art. I don't know. I just don't know, ya know?","all you have to do is put it in context of what people might relate to. if you do that, it will immediately unlock everything you are expressing, for a general audience. have you considered incorporating guy fieri's face or ass into your paintings."
Which of those books in your bookstacking video would you recommend getting?,none.
How can someone be as cool as you?,
any advice on writing an analytical essay efficiently>?,just go in and analyze the fuck out of that shit. get right to the heart of the point in as few words as possible. using pictures might help too.
I think you're great. If someday I get the chance to give you a puppy would u be my friend?,i am not currently accepting puppies.
where do you get your ideas for songs man?,"left field, right field, center field, the important thing to remember is they all come from the baseball field."
"You're a little impossible, I'm trying for you to give me a chance, how am I doing?",have you given me a chance.
What is your favorite tank?,think.
do you like horror films?,no.
I know you made a reality video about collaboration but it was quite some time ago and I was wondering if ou still feel as conflicted about collaboration?,"i ultimately was able to move forward working alone, and have made a lot of progress since then."
why do i get tired of people so quickly yet i long for company and understanding?,maybe you are special.
Why are you hesitant to answer certain questions Mr. Bill?,"the same reason you might be hesitant to answer certain questions, please don't call me mr."
is your bandcamp http://billwurtz.bandcamp.com/ actually your bandcamp? i see that songs cost money on there which i thought was something that you were against. you can avoid songs costing money by making them cost nothing?,"i have everything on my own site for free, because it seems like a friendly thing to do. but many people are not used to getting music that way, so as an alternative i sell it on itunes, etc. but that's really just a charade for people who are accustomed to thinking you have to buy music. if i didn't sell it there, people would be asking me where they can get it. so i figure rather than spend time explaining how i'm offering it for free, i figure i will just offer it both ways, and everyone will find it in a way that they are comfortable with."
if i have a limited budget but want to start recording some dumb stuff should I buy cheap instruments or use software instruments?,whichever one you are already more comfortable with. i can give you more detailed advice if i know more about your situation. it is important to follow the path of least resistance.
You have three wishes from a genie. What do you wish for? More wishes is an acceptable but boring answer.,"well first i would wish not to have a genie, which is a wish i already made without a genie, and so far it has come true. so it looks like i may not need a genie."
Why you no capitalize I mister Bill?,i can think of 3 reasons. 1. i don't have to. 2. capital i already looks like another letter. and 3. a lower case i is much more personal and has more personality because it has an eye.
