question,answer
?,Tom Hanks. here is more info.
how do you nuke a small country?,believe in yourself.
"On a scale of 1 to terrible, how terrible do you think wearing socks with sandals is?",it's fine.
do u wanna put ur hands in mud?,"not now, thank you for the opportunity."
did you have to lift yourself up to drop yourself on your head or did you just go for it?,my mom was carrying me and i jumped.
why don't u play drums in ur music vids (u play rad air drums but just asking)?,"try playing drums in your house or apartment building at 3am (or any time, really) and i think you will understand the problem. unless you live in the desert."
can you do a sex tape?,"tape? are you fucking kidding me, what year is it."
How do you make good emotional connections with people? I have friends but I don't really like them and I feel like they don't really like me either?,i'm sure you are better at it than me.
"HEY!Like, I didn't wanna write anything, but today was such discoverfull (can I say that?? I'm not from 'round...) day and I wanted to say hi to someone and I found you and then I though I should say something and am now writing and I'm gonna regret it later but I don't care!I'm sorry?",hi.
you seem like one of those guys in high school who was in the honor classes but was always sleeping in the corner with hoody up and headphones on?,"almost, but after 9th grade you can't stay in honors classes unless you spend many many hours doing homework, which i was not interested in."
why was your shorty award acceptance speech so simple?,my question would be why were the other ones so complicated.
ok but is it ever really cold in Alabama? 101 degrees certainty isnt?,"that was june 28. i was only there for a week. according to my calculations, in winter it is really nice."
what's the hardest instrument you've had to learn to play?,does typing on a smartphone count as an instrument.
do u really exist?,let me check.
you best not be teasing about that new vid?,there will be many. the first one will be the shortest (about 3 seconds). i am trying to get a head start. already almost done with the first 4 videos.
have you even been to Alabama?,
"When learning how to play, was there a certain instrument that you seemed to pick up easier?",drums and piano were the ones that were available.
when is your next video?,"extremely soon, possibly today."
i want to play volleyball but i get really sad and angry with myself everytime i mess up and during games i just start crying a lot. is it worth continuing to pursue something you (mostly) enjoy if you suck at it and can't handle failure?,"yes, absolutely. this is a normal side effect of caring a lot about something. another side effect is you will become really great at it."
favorite soul progression?,does unlocking the secrets of human consciousness count as a soul progression.
we have the same name! why do you go by bill instead of william or will?,that would be way too much w.
How do i stop wanting to die?,that's a trick question.
How to get to new canaan?,that depends where you are now.
Why am i such a stupid fucking idiot?,does being just fine and on the right track count as being a stupid fucking idiot.
How do i stop being afraid of rejection?,try to find new and interesting ways of being rejected.
Give me your best answer (in not too many words) for people who go crazy believing everything is a conspiracy. I need that ONE phrase that shuts them up ;-)?,does trying to survive count as a conspiracy.
would you ever consider having ur body cryogenically frozen? I'm not offering but just wondering?,seems legit.
How do i relax?,stop doing everything else.
How come I can't go outside without an ad shoved in my face?,"these are relevant product offers for you, based on your behavior, conversations, moods, and thoughts!  please give us your feedback:."
How are you reacting to your sudden increaae in popularity? :^)?,i mainly reacted to it last year. ever since then it has been a gradual increase.
have you ever been to kentucky?,i doubt it.
Why would i want to be myself if i'm a loser?,you are just fine the way you are. whether or not you call that being a loser is your choice.
why cant i be a triangle?,"if you want to, you can have some similar characteristics."
Do you think death is the only answer?,depends on the question.
do you ever get drunk?,"only for work, sometimes."
"in your lyric section you have a song called 'i'm so shy' but it isn't in your songs section? would really like to hear it, the lyrics are extremely relatable tbh?",it's a total shitpost. probably worse than 'dumpies.' i took it off because it really is terrible.
what is an obscure piece of music theory that has helped you in the past?,bagpipes are annoying. sorry bagpipes.
what is the secret to success?,be ruthlessly yourself.
Do you reccomend lying on the floor?,"sure, sometimes."
Bill how can I stop being depressed?,get abducted by aliens.
what do you thing about drugs?,does america count as a drug.
When you made all your reality videos did you make them because you thought they might come in handy in the future or did you make them for your own personal ref?,both.
So what's up with all the quotes about leadership etc on your walls? I'm intrigued?,they were there before i moved in.
do you like playing drums or do you hate it like a bitter lemon?,i like it but the set up and tear down is a real drag.
how do i stop being sad?,start being something else.
how do you motivate yourself to continue living?,there is still a lot of stuff i need to do that i think no one else is going to do.
What if i just stopped?,.
any advice on writing an analytical essay efficiently>?,just go in and analyze the fuck out of that shit. get right to the heart of the point in as few words as possible. using pictures might help too.
I know you made a reality video about collaboration but it was quite some time ago and I was wondering if ou still feel as conflicted about collaboration?,"i ultimately was able to move forward working alone, and have made a lot of progress since then."
why do i get tired of people so quickly yet i long for company and understanding?,maybe you are special.
is your bandcamp http://billwurtz.bandcamp.com/ actually your bandcamp? i see that songs cost money on there which i thought was something that you were against. you can avoid songs costing money by making them cost nothing?,.
"If this isn't too personal, around how much have fans donated? In particular, I'm curious if it's more than what ads would have given you if you'd chosen to go that route. (I totally admire your anti-ad stance, by the way.)?","i've gotten something like $500 from fans, in total. but i have received upfront advertising offers of $28,000, which i turned down."
"i dont have any money to spend on video editing software at all but would really like to try making videos like yours, do you know of any free video software that will provide me with the basics to get started. if i actually stick with this and make kind of nice videos with this software i will find money to buy better software and continue?","great news, you already have exactly the right attitude. i know imovie is automatically on every mac, and that should be more than enough to start with. i don't know what PCs have, i've really never used them, but that doesn't mean there isn't an easy option there too. i can't explain how strongly i think you are on the right track. starting with a heavier program, you will automatically fail. starting with an easier program, you will automatically succeed. and you will inevitably upgrade things as you are ready. and then everyone will want to know what program you use, and you won't want to tell them, because you will feel so much more passionately about the importance of starting simple, and that which program you choose doesn't matter."
i cant buy things i feel like every decision i make is the wrong one?,"try to make even more wrong decisions. with a little focus, you could become Wrong Champion."
do you love me?,
How did i get here?,where.
When will you make another video?,i am working on some now.
Do u think Obama will reveal UFOs like he said?,"he never said he would. but there is one guy named steve who is pretty sure he will, so."
how do i gain the powers of controlling potatoes?,outsell your competitors.
i am a piece of shit how do i stop being a piece of shit?,the way you are is just fine. it's up to you whether to call it shit.
if you were the president what would you do to make world peace?,"well, if you destroyed the world there would be peace. but i don't think that would be such a good idea."
Will there be more videos like history of japan? It's actually my favorite video on youtube <3?,
I kinda have to decide what I'm gunna do with my life in the middle of next year. What do I do? They always say do what you love but I love everything I do and I can't do everything? Pls Halp?,"stay confused for as long as possible until you can't take it anymore. that may not be the best advice, but it worked for me."
are you a question?,"yes, many. and also answers. everyone is made up of questions and answers."
also i have some things to say to you that are not questions but more likeyou know when you feel like you have too much love in your heart and you wanna share itwhere do i do that? i'd like to do that anonymously if possible?,"you can email me, or if you don't want me to see your name, just post it here and say don't post. i will never post any question that requests not to be posted."
will you make more history vids? they surprisingly really helped :D?,
Ask me a question?,what are some of the advantages and disadvantages of updog.
how can I tell if I want a tattoo?,"just get it, and if you don't want it later you can always decide to regret it."
Does music have to be worth something to athe least one person other than the composer to mean anything at all?,"it's hard to say, because what if the composer is living alone and writes something that will be meaningful to a lot of people once it is heard, but hasn't been heard yet."
"how do you feel about breaks in consciousness and the crippling uncertainty that you are not the same person that went to sleep earlier, but perhaps just a perfect clone filled with that person's memories and personality? asking for a friend?",i don't see the difference.
why does my dad hate me?,same reason you hate someone else who thinks you hate them but you don't.
"why did you change your answer for that fav question? by the way i fully agree eith everything you're saying about favourites, it doesn't make sense to have favourites because everything is made up of several different qualities that make up a thing and you may really like certain aspects of things at certain times and dislike different aspects of the same thing at different times, its crazy to decide that any one thing is something that you like above all other things and sometimes even vague comparisons between two things can be hard unless given criteria for why you would prefer another?","it was a tough question, and it really got to me. maybe because the person called me a douche. it kept bothering me an hour later so i revised the answer, which i do sometimes with difficult questions. i'm so glad to hear that someone gets where i'm coming from on this issue."
example of right and wrong bridge (in your opinion as for what the music wants)?,naming specific songs and critiquing them is too sensitive to talk about here. would love to talk about it via.
I'm?,sorry.
what is your fave animal?,
do you like pie?,let me check.
"Do you know your Myers-Briggs type? Even though I don't know you personally, I feel like you are an INFP due to your shyness, emotional sensitivity, and empathy for other people. You don't seem to harbor any negative emotions toward anybody, except yourself, which is a strong sign of dominant Introverted Feeling, which is the leading cognitive function of INFPs. You are also very creative and break the rules with your videos and go off on a tangent frequently, which hints towards a high Extraverted Intuition, which is the auxiliary function of INFPs. If you have no idea what I'm talking about, you can look at your description here: https://www.16personalities.com/infp-personality?",
what are you?,
why don't you use upper case?,PERHAPS YOU COULD ASK YOURSELF THAT.
"Have you ever considered doing a video where you just talk to us and we can get to know you, like answering these questions that you get, but in video form ya know?","if i'm answering questions in videos, i think i would prefer to fully."
what does it feel like to be you?,very serious.
what is a good way to exist nicely?,"i dunno, fly kites."
are you 100% sure you're alive?,great question. yes.
do you have a message for your fans today?,"hi, hello, etc."
my friend and I are wondering if you're ok and/or single?,i am both.
why are we like this?,to see what it's like.
i am not sure if im real what do i do?,you are as real as real gets. so don't worry about it.
is everyone the same or do they just seem that way?,i find that people have many similarities and differences.
How are you today? (5/22)?,
"HI MY NAME IS FRIND, PLEASE COULD YOU TELL ME YOUR FAVORITE MUSIC GENRE? thanx?",
what's the place you'd most like to go to right now?,cambodia.
Do you think it's important to find a 'purpose' in life? Or do you just sort of go with what you're feeling at the moment? If that makes sense?,you'll know if it's important.
"history of japan seems like it was such a big risk, how cool was it to see it pay off like that?","it's pretty neat, and great news for risks. which is good, because now that everyone thinks i'm only doing history for the rest of my life, it looks like it's time for another risk."
are you going to make more videos like history of japFUCK FUCK FUCK FUCCKKADGLWRJ R)@#U$@$GKBFM>VFF:?,
what is a question?,
Are you an optimistic person or do you find it easier to simply feign optimism when dealing with life's problmes?,i am extremely optimistic.
would you like a hug?,
just asking to see the time?,
when will the world end?,it has been ending and starting simultaneously this entire time.
Will you ever do a non-singing video? I want to get to know you?,i have done many many non-singing videos. i used to do them every.
say the first word that comes into your head right NOW (please)?,"shromp. wait no, actually shormp."
what do you do when you're sad?,walk through several zip codes.
Would you like a girlfriend? *wink wink*?,yes. but i'm not sure if i'm capable of getting one.
this is not a question?,
Do you think I'm cool?,i don't know who this is. but everyone is cool. so yes.
What's your opinions on queen Elizabeth?,i think she has been the queen for a very long time.
do you appreciate memes?,what's a meme.
when new video pls respond?,i'm writing a whole bunch of videos now.
Whats the point of not killing everything?,all those things get to live.
"okay, so, basically you have (or used to have) a group of friends, right? i'm referring to the mail you forwarded with your record and the recipients : )?","i actually don't really know most of those people, and some of them i have never met. but they were all confirmed fans, which i found out from consulting the 2 (maybe 3) people who i originally gave the music to, who in turn gave it to all their friends, and their friends friends, etc."
hey?,hi.
Do you have a message for me?,who is this.
What's your personal view about Texas?,it is technically part of the United States.
Will people ever run out of questions to ask you?,many people already have.
will you support trump if he is elected as presidential man?,.
are you gonna make history videos for countries besides japan? that would be cool?,
"Why do you refer to yourself as 'we' in your 'reality' clips? (Congratulations on releasing it btw, you've fully exposed yourself as being an enigma.)?","i think i use i you and we equally. if you happen to know which is the correct pronoun to use when talking to yourself, feel free to let me know."
Have you ever tried making a poem into a song? As in using the words as lyrics and making a tune?,"doing that is very uncomfortable for me. i strongly prefer to be able to create the lyrics and music together. doing it completely seperately would be a fun challenge, but in my opinion not the best way to create music. then again i live by myself and am insane."
"Is Bill Wurtz, who you portray right now, a character/persona? Or is this genuinely just you and you're actually this ingenious and amazing?",
what is music?,
will u ever make more jazz?,"probably, but it's not that big of a priority compared to more music, and different types of videos."
why are we alive and why does it matter?,it doesn't have to matter if you don't want it to.
did you actually walk that 8hr walk inland? like forreal? I gotta do that?,"yes, i do that type of thing a lot. i can't explain how fulfilling it is."
how can I stop being jealous of you?,realize i don't have that much.
"Have you ever been to Japan? (No, I am not asking whether or not you will be making more history of videos.)?",
do you like ribbons?,they seem nice.
what is your advice for someone whose musical ideas are not flowing?,revert back to whatever made you want to do this in the first place.
why do you have such an affinity for lowercase letters?,YOU JUST ASKED THAT QUESTION USING ALL LOWERCASE LETTERS. PERHAPS YOU COULD ASK YOURSELF.
do you have a process for music writing or does it just flow?,"you have to use both. the original idea usually comes out of nowhere, then you have to usually do the work to bring it into reality."
what do you think of the time and it's 24 zones?,i think they are all doing a great job.
have you ever been arrested?,no.
What do I do if I'm nervous about exams?,take the exams.
how many hours in a day do you spend watching cute animal videos? im worried you aren't watching enough friendo?,0.
are questions real?,some of them.
when will you upload more videos on youtube? they are very fantastic and good looking?,as soon as possible.
"hey not to like tell you how to do your website, cause it's yours and people bother you about that all the time, but i just thought you'd like to know that if you embedded your videos from youtube instead of uploading them to your site they'd load faster.  Then again, you'd probably have to make an individual page for each one, which would be time consuming.  But then i guess you could just link directly to youtube.  idk where i was going with this?","i think they would run slower if i did that. also it is extremely important that it runs without glitches once it loads, and also to be able to have quick access to any point in the video, easy pause/unpause, etc. all those things are made extremely difficult on youtube. also, easy downloadability is something i value above all else. the ultimate viewing experience is watching it on your hard drive, in my opinion. that's why it is extremely important to me to provide that experience for people. that's what this site is for- i'm giving you all this content. for those who prefer the youtube experience, they can watch on youtube. and for the shorter ones i would recommend vine."
will we see the side project you are working on?,absolutely. i am now trying to wrap it up and post what i have. looking forward to moving on with my life.
"If you ever develop a live show, what do you think it'll look like? Would you play pre-recorded audio and sing along, or would you find other people to play the other instruments? Or would you do something different that we couldn't possibly imagine?",
How to be as epic as you?,don't take yes for an answer.
why am i so afraid of getting my work done?,because you haven't decided how you're going to do it yet.
maybe what you're making isn't a video at all. and maybe its like serious. or something?,
can you be my friend?,
do you think the Riemann hypothesis is true?,yes.
what do you think happens after you die?,whatever you're ready for.
what do your relatives feel about the videos you create?,i'm not sure.
what do you think of lamps?,i think they are great.
Talk to me about externatities and the buffer stock scheme?,buffer stocking would be when the government keeps a huge stash of memes in case of a meme shortage. externalities would be like pollution from the meme factories.
pepsi or coke?,
what is your favorite kind of angle? obtuse or acute?,.
Do you prefer eagles the band or animal?,i think they are both doing a great job.
"did you ever check out this website this cool guy made to let people ask him questions? you should try it, links at http://www.billwurtz.com/questions/questions.html?","yea, the guy's a fuckin jerk. he won't even answer my questions. i've been trying to ask him what his favorite band is for weeks. it's like he doesn't even understand the question."
i miss you?,i miss you too.
Why is eye contact so hard for me?,it is probably due to your thoughts and feelings.
what are your thoughts on shoehorns generally?,i think it could be a real game changer.
What do I do if I want to be funny but I'm not and I can't remember jokes that well?,i think you are on the right track.
can u answer emails like faster? ive sent like 4 in 2 days and got nuthing >:(?,check the address. i haven't gotten more than 1 email from anyone in the last week.
"could you consider making a history series? It doesn't have to be that accurate, as long as it is entertaining?",
mbti type? (entp?)?,
what do you think of vegans?,"i have many vegan friends, and let me just say, i think they are wonderful people."
Where do parents come fro?,more parents.
Any tips for getting through high school finals? pls help?,you're asking the wrong person. i did not do well.
where are you?,pyongyang.
Do u love me?,
"have you generally found the workflow to be more straightforward to compose music first and create the video afterwards, as opposed to creating a video and then scoring the music to that? also i love you and i'm happy you're working on what you love for forever?",it depends which video.
any advice on how to stay sane?,"think about the nearest ocean, or other major geographical feature."
AAAAAAAAAAAAAAAA?,you make a good point.
who are you?,i will check.
Do you currently only answer quick questions which don't require much thinking? So u have more time to work or something?,no.
what's something I can stop worrying about for good?,the unibomber.
Do you believe there is an inherent meaning to life? Or do you think life is ultimately meaningless but that individuals should find their own way of making their life mean something? Thanks?,
why do you think that some concepts are really deep and some concepts are really simple or at least appear to be? what makes it so concepts are some certain amount of deepness or simpleness? sorry if this is a bit unclear?,if you go to settings you can adjust it.
why?,to try.
do you pronounce gif as gif or jif?,i have never said it out loud.
How to be in college but still be productive and work all the time on things I care about? (music)?,"if you don't go to class, that will free up a huge block of time right there."
what do you think about the internet?,i think it's off to a good start.
"will you make more of the history of ... videos?I read somewhere in your other video before you uploading the history of japan,you said you are preparing new video in the last 4 months?is that how long you make the history of japan video?if yes,will it mean there's still hope for another history of ... videos?sorry for bad english,also please try not to die before finishing atleast 100 history of videos,if you die bfore finish that 100 videos I'll kill you to death!im not joking,thx?",
how are social norms your favourite memes? you don't seem to conform to them and this is unrelated but personally social norms are 100% my least favourite memes?,"for those of you just joining us, the word favorite makes my mind implode. i usually either refer favorites questions to the."
Do you like me? CAUSE I LOVE YOU?,who is this.
"in order to maximise originality, do you avoid listening to or watching other people's work? You seem to place a large focus on doing what other people don't do, so surely seeing other people's stuff would affect your subconscious? Thanks?","i think you're right, but the real reason is i don't have time. i do make an effort to keep up with popular radio, but if i want to succeed at what i'm doing it requires full time hard work, so that's the more realistic reason why consuming of other content is sometimes neglected. if i spent my time watching other peoples' content, you would see much less content from me, and there is already not enough, in my opinion. i hope that makes sense."
are you afraid of dying?,more afraid of being born. whoops already did it.
what is your favourite meme?,social norms.
is there a chance that you'd still be romantically interested in someone if they did not have good math skills? asking for a friend?,who knows. anything's possible.
how long did it take you to make the japan video? love from finland?,
okay i know you have a yes video and a no video but did you also make like a maybe or i don't know? or did i imagine those?,
"i am, new. trip, i am ,  new trip. i am, the colors are insane. is this about an acid trip? the answer is either 'yes' or 'no'?",great question. no.
When Will You Do The Next History Of A Country? Really Waiting For That :)?,Right When You Least Expect It.
When are you uploading your next YouTube video? We miss you?,2016.
what is your favourite thing in the world?,the sun.
answer: yes?,now you write the question.
do u like clams?,never had one.
