question,answer
how far do you have to look back in your past work to start finding it embarrassing?,about 6 months.
in the sheet music of i like there's a second verse so i was wondering why it ends after the oh damn yeahs instead of continuing?,wow i totally forgot about all of that. guess i must have made an executive decision in the studio. probably thought it was stronger to wrap it up there.
is it okay that i ask almost more than three questions a day here?,i think that's great. i'm sorry if i haven't been able to answer all of them. feel free to introduce yourself if you haven't already.
modern medicine: fact or fiction?,murder mystery.
isn't it ironic how i like alanis morissette i learned the word from her?,"hey what can i say. you live, you learn."
who is the best?,"you, duh."
did you ever get bullied in school bill?,the bar has been constantly lowered for bullying. nowadays i think frowning at someone is considered bullying. so yes i was bullied.
What are you looking for in a significant other? Other than them being 'as impossible as' you?,strong math skills.
"i know you work alone, I get that. but have you ever tried creating with another person? The biggest advantage I take out of this is because it is more fun, to laugh with another one. keep up the good work! love you?","trust me, the only reason i work alone is because i have to. i spent years and years thinking you were supposed to collaborate, and that i was just messed up for not being able to make it work. i knew i could do it alone, but i thought it was frowned upon. and i knew it would certainly be more enjoyable and less lonely to work together with someone. but i very rarely found anyone i could work with, and i tried many many times to collaborate and failed miserably. i just always wanted to take it to mars way too quickly. no one would really take me seriously. while the whole time i thought i was the one being serious. finally i saw an interview with a very successful songwriter about collaboration, and he said i actually don't collaborate well. one of the reasons i like songwriting is because it's something you can actually do all by yourself. that's when i finally stopped feeling guilty about it, and that's when the real work started. ever since then everything has been going fine, although i am still lonely."
have u ever been in love? with a person? I only include that last part bc u have a tendency to avoid answering questions by being a smartass?,i think the proper term is dumbass.  and yes.
did u bulid this website or someone did it for you? if someone did it for you kill him and if you did it kill urself my man?,
Rate your memory from 1 (almost non-existent) to 10 (almost eidetic)?,9.
"Est-ce que tu voudrais une amie nouveau?(C'est moi, l'amie est moi)?",oui svp.
How do you deal with procrastination ? ... Also hi?,
what kind of tiger would you be if you were to be one?,"a sensible one, with a strong moral compass."
Can you make more Japan type videos? They're funny and informative and can make u $$$?,
"why the umbrella, dude?",
ETA on next history video even like a month or year please watching your Japan one over and over only does so much for me?,"the japan video was a surprise. no one expected a video in that format from me. so far surprises seem to do very well, and i will continue on in the surprise format."
what do i do if im not musically talented but all i wanna do is make music?,"if you know that's what you really want to do, then you are going to be just fine."
what time do you go to sleep?,"15 - 20 hours after i wake up, if possible."
when do you wake up?,"usually about 7 - 10 hours after i go to sleep, if possible."
"do you ever drink tea, if so what type?",no.
what's a band?,
what type of software do u use for ur videos. I have a history presentation coming up and the teacher said make it not lame af?,i don't see how those 2 issues are related.
"What is your religious belief (god, dog, pasta)?",it's cool.
how often do you stay up through the night?,"i am awake for at least some of the time during most nights, and days. i hope that aswers your question."
bill are u dating someone?,not sure what that is. i don't think i have ever done it.
TYPE A WORD QUICKLY WITHOUT THINKING GO?,"plufk. no sorry, plorfk."
what's your favorite word (mine is suckle)?,my favorite word is of. some days it is the only word i use.
why is it so hard to be a person?,it improves your skills.
"hey so since you've reserved a name for yourself on younow and you actually want to livestream something, why don't you just livestream yourself answering these kind of questions? if you get like 50 - 100 questions per day i'm sure you could get a bunch of them for the session and they won't all be trolls they could be like a lot of the nice questions you get on here like about your music and about you and like advice?","it would be pretty boring, just me typing."
Yo fam :D will you still do more history videos like the history of japan? :o  Bigfan here m8. Eyy lmao?,
also do you think you're cool?,
would you maybe consider doing a livestream of something fun? even if it's book stacking 2 it'd be a boon?,yes.
pls date me?,ok.
what is ur favorite thing to eat?,ideas.
how do you go about harmonizing people? (like paul and the weather lady)?,"first i find all the notes. speech is kind of crazy, a lot of notes are actually big swoops, so you have to make a lot of decisions on what to say the notes are. then you have to go through and decide how the chords should go, and i have no way of explaining how i do that. there are a billion ways of doing it, and it's really like writing. you have to find a way to paint a musical picture out of the nonsense. it's a really crazy task, and you have to think of the big picture."
Am i alive? cuz i don't think so?,as of 10:42pm UTC you were. and if you are reading this now you also are. i hope that helps.
"what do you think of England? (eg. good, bad)?","very english, in my opinion."
i noticed that i dont think anything is real. what do you think?,that doesn't really change anything.
WHY DID U STOP MAKING HISTORY VIDEOS PLEASE?,my most recent video was actually a history video. it was also my first. i think start would be a better word than stop.
A day= the time since the clock read 00:00 most recently. How has your 'day' been since that time?,pretty good.
Do you know this guy? http://www.billwurtz.com?,almost.
"i noticed you've been more sassy lately, why the sass?",i haven't noticed that. also what the heck is sass.
how do i play the electric guitar?,"press strings against the frets with your left hand, and pluck or strum the strings with your right hand."
When are you posting your next video? Are you gonna go back to short ones?(4-15 seconds) or longer like history of japan? thamks! love your videos :)?,"i love all the time lengths, and many many different formats, and have been wanting to explore it all for a long time. in 2015, my biggest following was on vine, which has a 6 second time limit. this resulted in a lot of pent up desire to do a wide range of much longer projects. i finally got my first one done, and forunately it was received well, and during the next year or two i will be continuing to explore a wide range of possibilities in longer content, although over time i hope to settle in on a good balance of all time lengths (everything between 1 second and 10 minutes)."
how can i show someone that im eating my cheese aggressively without saying  im eating my cheese aggressively >:( - self?,"i think your best bet would be to actually perform the action in front of them, or via video feed."
how do i play bass guitar?,"press a string against a fret with your left hand, and pluck the string with your right hand."
Are you going to do more ideas like there history of Japan? I think a lot of ppl would love to see more tbh?,
any idea on why russia bought 5 dolphins secretly?,"to help spot underwater enemies, particularly in the black sea."
best way to adjust to jetlag or just moving to different time zones and having to wake up at very different times in general?,"take advantage of your unique locational and circadian state of mind, and take a moment to reflect freshly on your current life circumstances. it will be easy to think in a unique and fresh manner at this time, because you are in a new location, and awake at perhaps an unusual time."
why did you decide to start making these videos/jingles? (which i love)?,"had years worth of written content, but nothing was getting recorded fast enough. i finally snapped on about jan 29, 2014 and made up a 5-day a week content posting schedule, and followed it for a long time, and eventually made a few slight adjustments."
its me ur girlfriend hi?,hi. do you really think this page is the best place for us to communicate.
its me ur future girlfriend hi?,hey. i miss you.
i constantly feel down on myself because i believe i am not right. i dont feel like i can make a succesful song or anything of the sort. how do you do it? im just very curious because the way you do music really interests me?,"i am going to give you the same advice which was given to me, which is absolutely no advice. it may not seem helpful, but if spend a couple of years letting it really sink in, you will be well on your way."
how long did it take you to make history of japan? It's really well done so I expect it would've taken months at least?,
do u have any advice for today's youth?,"continue being young, and then get older eventually. hope that helps."
can you upload morenot really a question?,.
i am very very sad today can u help me feel better?,i am trying.
How do you spell question?,question.
how to hire a samurai?,
how do i ask a question?,
Would you ever want to collab with anyone ? Need any partners ? Your videos looks fun to make?,i don't collaborate.
do u like me?;) check yes or no?,who is this.
what is the moon made of?,"rock, i guess."
what are your thoughts on thoughts generally?,they are more connected to your breathing than you might realize.
how do u overcome procrastination?,
Do you have an opinion on drugs? Select;1. They're good. I like them2. I don't give a shit3. They're Bad™?,"depends which one, and also what counts as a drug. also what counts as good and bad."
"in the early twentieth century, nationalist movements in africa, asia, and the middle east were led primarily by?","um, the british? just a wild guess."
do you think people can train perfect pitch or would they just be straight fucked if they didn't get it within the first 3-4 years of their lives?,"depends how good you want to get it. mine was mostly reclaimed at a later age, and as a result i have it at least as good as most people who claim to have it. so i just say i have it."
Will you make more educational videos? :3?,
you're really cool how can i be as cool as you?,
my favorite saying is 'fuck you' what is yours?,"my favorite saying would vary depending on what is needed to communicate. for example, if my house was on fire, my favorite saying might be something like aaaah the house is on fire."
what are your thoughts on boxes generally?,"i think they're great. a very useful asset, worth the investment."
did i see you in a grocery store once? i doubt it?,"it is likely. in just the past 5 years, i have been to the grocery store twice, and one of those times i was there for more than 3 minutes."
i love u will u marry me?,yes! i marry people all the time. it's one of my hobbies.
whats my name?,if i had to guess i would say osama bin laden. although i am not sure.
do u answer all of these?,
Wouldn't it be amazing if all lonely people happened to get along with eachother?,i think they probably do.
"assuming that you're not currently working on videos, does it feel any different to be working on something else? or not really?","well, yes. it that sense it reminds me of working on japan, because that was something totally else and it took a long time to make and nobody really knew i was doing it. so this process reminds me of that, but this project is actually even more else. it really stresses me out sometimes how else this thing is. but i have to do it cause i've been wanting to do it for a long time and this is the right time."
I think I have depression. Any tips on how to survive?,try doing things sideways.
how come that at 5:27 you answered a question then at 5:25 pm you answered another question above that? i dont think time works that way?,"the times are when asked, not when answered. but i do intend to keep them in order, and i fixed it. thanks for letting me know."
help how do i get a girlfriend?,step 1 is to ask someone who still hasn't figured it out. congratulations on completing step 1.
i forgot the watercolors at school and im going to get a zero on my project h e l p?,"people have made way worse mistakes than that, possibly even in your class."
?אתה מדבר עברית?,לא.
להיות האהבה שלי?,בסדר.
are you worried you peaked with japan and are on a slow decline into mediocrity?,no.
do sunflowers come from the sun?,not exactly.
How Can Mirrors Be Real If Our Eyes Aren't Real?,they are both equally real. i wouldn't worry about it.
what are your shower thoughts?,i think they are good. i wish more people in the world had access to them.
"last night i asked if i could buy you a house. since you said yes, where would you like it to be? what kind of house? how much money can i spend? all these questions are pertinent to the survival of the wurtzian race?","spend as much as you want. looking to be in the vicinity of new york city (if you go outside the city, i would say go in the long island direction. also not on the southern coast). need a studio where i can make noise, so if there are neighbors then there needs to be a sound isolated basement or something."
is feeling lonely selfish?,not if you are.
where are all of the geckos (or at least most of them?)?,"most of them are on the television, ensuring daily that you have a miserable experience."
Will you do another history video? It was one of the only times I thoroughly enjoyed learning something that won't help me in life?,
what inspires your songs?,the part where you get to make something up and have it go into peoples' minds.
"do you examine your own motivations (in a rigorous sense?) if so, do you find it helpful, frustrating, useful? thanks for happening to exist (and both of those separately)?",yes.
Opinion of King Henry VIII?,i think he's doing a great job so far.
what software do u use?,
what note is the best note?,"that's hard to answer, because the main reason notes are good is because they are bad."
How do you balance witty-online-cynicism and compassionate humility? How many focus groups did it take? Thank you for much (more than i probably now realize)?,.
"Why do i want to ask you a question?p.s. i don't expect you to be able to tell me, but that doesn't preclude an answer?",because there's no other option.
"So the AP European history exam is in 10 days any chance you might happen to be doing a vid on that, otherwise rip me. Thanks for your time?","i can't do another history video now, i just did that."
"hey Bill,have you got a name for that classic soul progression that goes VI-V-Im-VIIm-III-VI-V -Im? Like just the two of us or if you want me to stay (but in this case already beggining in the root), and have you ever heard any nice twists to it?Keep up the good work! Love you?","i don't have a name for it, other than to say it's the good old 5min to set up the 4 except it's used from the perspective of the relative minor. so like, if you're in a minor key, it's when you go ahead and smack the flat7min7, to set up the b6.  honestly, a pretty slick version of this which you might get a kick out of, is in the verse of 'let me love you one more time' (benson). and then there's obviously biggie's 'big poppa' which i believe is actually just isley brothers. also check out the second verse of a song called You by mya, on the word grow. this one has the extra passing tone thrown in for bonus points. Also, another twist i just thought of -- a lot of songs do like a 2-5 and then another 2-5 a whole step lower -- so it actually kind of has that same effect when it hits the 2 of the second 2-5-- sounds like the b7min7. example of that would be c'est la vie by robbie neville. 'love' by musiq does another one chromatically in the verse, but the melody doesn't obey it as well as the 'mya' example.  here's one that may seem subtle -- there was a mariah carey song (maybe 2006??) called 'shake it off it's really just 3 chord hits, but it implies the same thing. t-pain 'show you how' also uses it pretty quick. also 'luv' by janet jackson uses it very expertly, with a gold-plated tritone substitution thing for the inbetween chord. basically all these are the b7min7 (to usually set up the b6) from a minor key. hope that's what you meant, i'm just taking that as the main common thread between your examples. ultimately this is a good technique, which i bet not many people know nowadays, and it is surely a great way to get chicks."
"So, you think walls are a hoax... What are your opinions on doors? (I haven't seen your opinion on doors yet and I am curious)?",are you kidding? half my material is about doors.
"out of curiosity, are you into the vaporwave aesthetic trend because I heard all your instrumentals and they were rad af?",trends are for losers.
im sad and i dont know how to stop?,well where did you learn to do it in the first place.
"Notice you don't really use a guitar in your compositions? Any specific reason why or just preference? Maj 7, Min 7, add 9, add 7 chords can all sound really groovy with the right tone :D?",.
Make an evolution video?,ok.
Can I slide into your DMs? If you know what i mean?,my twitter app only allows 140 characters in DMs. so everyone's messages get cut off. all my messages look like: Hi Bill. My name is Gustav Jorbelson. I work for a Production Company specializing in forcefeeding content to millennials and I was wonderi.
what do memes mean to you?,i don't even know what a meme is anymore. i think they changed it.
history of poland? such a great country to make a video?,
how do you listen to music?,
"history of sweden, if it's not too much trouble? do you think you could make a video similar to history of japan for sweden? it's a pretty wacky country, so I've heard! your other videos are lovely btw?",
why don't you have favorites?,.
Sorry. I just sincerely want musical recommendation from you. This is from 4.22.16  4:29 am?,that's a very complex and sensitive issue. i would be glad to discuss it privately.
whats the difference between 2 based soul world and dorian and also 4 based soul world and lydian? RIP Prince?,"i guess technically there is no difference, but modal stuff i would consider more actually based in the key of the root. like dorian would be like 'so what' or 'can i get a'. and lydian (which is usually more of a momentary thing anyway) would be like the intro to a steven spielberg movie. this question will self destruct."
Who runs the world?  (I think it's cats)?,"no it's not cats, it's actually people. specifically, people with the most trust points. to find out how many trust points you have, go to the bank."
"Hello im kalle and ive asked u a few questions before!! Thank u for answering them. I really admire u and your music & creations.I think i saw a couple times that u think about why walls are the way they are,and i wondered, what conclusion did u come to about walls?",
how long did it take you to make the japan video?,
hellO yes i drank 9 glasses of water a day instead of 8 glasses am i going to die?,"no, you are going to pee."
does grass exist?,"i'm not saying. i don't want to ruin the surprise for you, in case it does."
hey its me ur girlfriend lets go?,where the hell have you been. and do you really think this page is the best place to talk.
Would you like to adopt me?Y/N?,who is this.
how many noses do you have and does it effect your eyesight?,"i have the normal amount. and yes, all the senses actually work together in a sort of intuitive fashion."
whats ur credit card info front and back?,my credit card is actually a leaf.
"Can you make more documentaries about countries? Like Thailand, China etc. I really like your style. Super dope! Peace?",
Hey whats your spirit animal?Mines a unicorn!!Cause one believes in me?,what the fuck is a spirit animal.
Come onnnnnnnn whats ur type?! Blonds or brunetts? ~Im a blond ;)~?,referring to people as a 'thing' based on their hair or skin color is offensive to me for some reason.
hey there's this girl. what do i do ~?,be yourself. that's probably what she's doing.
what's your mbti?,
do u wear tight pants?,i try to wear reasonable sized pants.
"Can I use a part of one of your songs in a YouTube video? (I'll give credit, of course)?",.
are you celebrating 4/20?,not any more than i celebrate most days.
"I am interested in things that challenge and defy the expected, and am willing to support original content that goes beyond the ordinary. Does this remove the purpose of my last question? (The one where I talk about requests and Patreon)?",i'm not sure.
will u marry me?,who is this.
How about putting a giant red 'FREQUENTLY ASKED QUESTIONS' at the top of this questions page? Or something along those lines?,seems legit. but then i would have no good way of responding when people inevitably continue to ask those same questions. that would make me feel more insane and helpless than i already do.
can onions have opinions?,"not usually, but when they do they express them."
are memes real?,i don't know anymore.
"Why not take requests for Patrons that pay more than $25? A custom song for those who want it, and it pays for the electricity?","one of the most important things i aim to do is go my own way, and deliver things that challenge and defy the expectations. if that is not what you are interested in, then you should not be supporting me."
Do you have a favorite band in particular?,"not sure what counts as a band. or a favorite, actually."
I'LL TAKE U OUT!!! !!! on a date maybe or something?,that sounds incredible.
r u wearing socks right now?,yep.
how do you take your eggs?,digitally.
do you enjoy gummy bears?,no.
if i give you $1000 would you be my friend?,i think i already am.
"Who made your website and how because that CSS is colorful, man?",bill wurtz. it's not css.
Do you have a cure for procrastination?,it doesn't always need to be cured.
can u make another history of a country?,
How long did the Japan video take to produce?,
when will you post the new video? i really need it?,i'm not sure what video you're talking about.
what country are you going to make a history of next?,great question. i'm doing something entirely different.
if i gave you 10 million dollars would you make a movie? also follow up question can you loan me 10 million dollars?,"what exactly is considered a movie, and how would it be different from what i have already done."
you are my reason for living?,that's why i'm here.
u should do another history video their pretty dank?,
Where is this aesthetic coming from? Only thing I can discern is the Futura font possibly from Wes Anderson?,"as far as i know, aesthetic is the name of a type of zombie that has been invading our planet since 2014. i am proud to announce that this is an aesthetic free zone."
what even is life?,a fun and interesting challenge.
did u ever get arrested?,no.
You're very interesting... What made you want to post all these things? :D?,"think of it this way.... if i didn't, you never would have heard of me."
What do you think of weeaboos?,i don't know any.
"hi! i was wondering if you could speak to the way that you used synths in the background of in a mellow tone? specifically, how/if you constructed them to support the melodic line? thank you so much?",.
What are you working on currently?,a reality show.
"this body isn't mine. can you help me find the original owner? i don't like this, i want a refund?",i just got a message from the 13 year old half-starving girl in bangladesh who made your clothes. she wants a refund for her place in society.
how do i know for sure if im real or fake and if reality is worth staying in if im real or if existence is worth it if im existing as a fake entity?,"you need to follow thru with the world you are in. if you choose to 'pass', you're probably going to get thrown into another world with all the same issues, and possibly with a slightly lower annual household income."
When did you start playing instruments?,when i was 2.
Why is surviving missing from videos? WHAT ARE YOU HIDING?,.
how i become a dinosaur?,"you just have to be what you're going to be, and hope someone calls it a dinosaur."
ok dude why did u forget that the us put an oil embargo on japan and honestly the nanking rapes aren't even admitted to have hapened so pls fix this errors~Emperor Tojo's ghost?,"the japan video is done. i am not re-releasing it. i actually added an anotation on youtube to address nanking, as well as u.s. rapes as well. the oil embargo i believe is covered in the 'no more oil for you.' (although i'm not totally sure what the word embargo means) other than that, i made this video a long time ago and i am not going to go back and do it again. thanks for the support."
sᴉɥʇ pɐǝɹ oʇ ǝlqɐ noʎ ǝɹ∀?,"yes, but the z-dot didn't work. the code for z-dot would have been &&num;380; . also, i wouldn't use the z-dot, there is a ¿ character, which is either &iquest; or &&num;191; which would look much better than ż."
