question,answer
what's your social security number?,4.
do you answer all questions?,no.
but.... just censor all the naughty words m8. like  replace shit with shoot and fuck with frick?,not exactly clear on which words are naughty and why.
opinions on opinions?,no.
"did you...stop taking...emails? :,(?",no.
don't get me wrong your usual jingles and videos are the best but i wish you put out long serious songs too that i could jam out too because your voice and music is rly nic e we need a real mixtape billy?,"imagine if all this time that was what i was working on. then imagine that on top of that, there are hundreds of people sending me messages all the time asking when i will do another history video identical to my last one. what would you do in this situation? just curious. feel free to email me with advice."
why are people rude?,"anything can be considered rude.  in some cultures, smiling is considered rude."
Are you communist?,
At what age did you start showing interest for music?,2.
"こんいちわ, おげんきですか?",げんきです。.
why do you have that room with all those printed out papers on the wall?,"i was living there during 2010/11 those were quotes, but i didn't put them up."
when will you bring out a lp?,i'm not too sure what LP means.
history of canada?,
"Do you play videogames? If yes, would you play them with me?","due to the insurmountable amount of content i have queued to be made, i now spend minimal time consuming content, and the majority of time making it."
what inspired you to hate yourself?,i don't hate myself. if i did i wouldn't have an entire website dedicated to myself.
"If you're walking down he street in a rowboat, and your wings fall off, how many pancakes does it take to shingle a doghouse? Answer: 4, because ice cream has no bones.","for a random riddle, i am amazed at how much that one has stayed almost exactly the same for at least 20 years."
where are the questions?,everywhere. this whole world is made of questions.
how are you so surreal?,i dropped myself on my head when i was young.
"Dude, how do I music?",music is something that happens to you. you just have to let it.
Why am I here?,where.
How do you manage to respond to all of these questions?,i don't.
what's next?,it's a surprise.
are you going to/planning to make more history of *insert country name*? You know for other countries? I was just wondering this because of how successful your video of history of japan is.,
Was there any specific reason you made History Of Japan? It's so different from your other videos.,
help?,i will try.
Do you drink soda?,not anymore.
what bands do you like?,what's a band.
how do you make money?,you have to fight and compete for it. at least that's the way it works on Earth.
Thanks for answering questions on your site. I wanted to ask a thing but didn't want to sign up for ask.fm. This is good. I feel like this should contain a question now so: What is a good thing to do when you're feeling overwhelmed by all the work?,the work.
Can you make a history of the United States?,
My friend quotes your Japan video all the time. What do I say the next time he tells me to get the door?,tell him you already have the door.
Are you going to continue making history videos similar to the history of japan video?,
how fast can you say disestablishmentarianism?,not fast enough.
being alive is terrfying help me?,learn from it. that's the whole point.
birds are sea lobsters correct?,not that i know of.
"Could I use one of your jingles for a school project? With credits to you, of course.",credits toward what.
how long does it take you to answer questions?,4 seconds.
can you tell me what you are working on riiighttt NOW?,questions.
have you tried buddhism? have you considered making musician biographies? has anyone ever asked three questions at once?,no.
"Do your parents know about your success? How did you tell them, or did they know about your vines?",they found me online.
do u like oranges?,not anymore.
What other topics are you planning to do? I honestly hope it's more history but anything would be great?,it's a surprise.
What do you feel about you being nominated in weird in shorty awards?,i think they could have found someone weirder than me.
ᕕ(⌐■_■)ᕗ ♪♬ hey?,hi.
Is this a question or it is a statment?,great question. it's a question.
do u occasionally sleep and drink water?,"yes, i do both quite frequently."
Can you please make a clean version of the History of Japan video to make it appropriate to show in public high school history classes? Thank you.,you mean take out the best parts? fuck no.
What's your zodiac sign?,
Have you considered creating a 12 hr mix of any of your videos?,no.
Best stress reliever?,winning a court case.
"all these people are telling you to make your site look better and to hire people and just... I think everything looks and sounds great. This wasn't a question, oops, what's your favorite type of animal?","the kind that is understanding and supportive, just like you."
What do you think about snowmen?,it would be nice to meet some snow women.
"Are you still going to make short videos, or are you focusing on bigger projects? Either way, I'm excited to see.",i have always wanted to do a mix of both.
What's your website?,
"For the history of Japan, what took the most time; learning about Japan, writing a script, editing, or making the music?",i posted this.
You said you write chords and melody/lead at the same time... how is that possible?,"it's kind of like imagining a baboon at the post office. boom, there's the idea. baboon at the post office."
Do you have any pets? Do you want a specific breed of pet? Is that breed a human?,"i don't have a pet, i don't want one, and humans should not be considered pets. i hope that answers your questions."
Is Bad Music a real thing?,all music is bad.
Hello! Do you think all lead or melodies are great if they are supported by a good arrangement? Thank you.,"do your best to make them both good. but then again, being forced to make a shitty melody sound good sounds like an entertaining challenge. i did a couple experiments with putting chords on everyday speech to get it to sound musical, and it was the most fun i had in my life."
Do you do all the animation in your videos yourself?,yes.
I live under a bridge? help?,renovate and sell!
where do cats come from?,cats.
why am I always suffering?,you'll have to be more specific. there are many different kinds of suffering.
what is your opinion on tomatoes?,they are not as good as they could be.
"Bill, may I call you Bill? I am an instructional designer (teacher of teachers) at a Technology School in Oklahoma I think your video style would be VERY engaging for students. Have you ever given any thought to teaching teachers (or teaching teachers of teachers) how you create videos for instruction? If teachers presented information in the same style as your History of Japan video, students would watch it multiple times. And/Or, would you consider doing a video chat with some students in a digital media classroom?",sure. i will teach anyone things if they think i know them.
"If I mailed you a dog, what color would you want it to be? (same person from the cat question a while back, PETS R COOL)?",i don't want a dog. i don't think it's a good idea to send dogs through the mail anyway.
favorite means 'preferred before all others of the same kind.' what is your favorite video?,not sure i understand the question.
when is the sequel for the video of the ceiling coming out? i still want to see the ceiling.,in the sequel you will actually taste the ceiling.
"you're on an island alone.  you get to bring one item, one food to eat, and one liquid to drink for a year.  what would it be?",i think there is a mistake in the question. i am not on an island alone.
How do you feel about people constantly asking you about the Japan video?,i think it is good training in case i ever do something that is even more popular.
"You know that HOJ getting a basquillion views doesn't mean you have to make more Histories if you don't want to, right?","i'm actually just going to make a sequel to that one.  history of japan, part 2."
How did you know that much about Japanese history? Did you take history as your major in university? I am asking this because I am just impressed with your recent video!!,i knew absolutely nothing about japanese history before i made the video. that is why i picked it as a first topic. it was a test run to see if i could learn a thing really fast and then spit it back out. i will be doing this with many more topics in the future.
"Hello Bill! I am often disassociating and very frustrated/sad/angry/synonyms for not okay. Your videos and music make me feel better and more like a person because they are something that I can relate too yet also find joy out of. When you first started uploading music, was your intention to connect to people in this way or in any other way regarding emotions and things like that, or was it more for a purely self-indulgent hobby that you didn't expect an audience to gravitate to? Either way, I'm very glad that you're so dedicated to what you produce and thankful that you exist in the online community.","as soon as i realized everything was actually ok, it became very important for me to tell everybody about it. because i figured a lot of people probably don't know."
What's the meaning of color?,you know when you see it.
What do you do in your pasttime?,what is pasttime.
"Bill, do you like preforming and/or writing with other musicians? How do you approach collaboration when/if you ever have to?","playing together is great. writing together is impossible. that's my fault, it's me that's impossible.  i apologize."
"I used to be a time traveler, but I was a pretty shitty one since I could only go forward. Any recommendations for new careers that need skills like mine?",how did you get it to stop.
Is musical talent innate or is it a skill anyone can learn if they're passionate and put in the work? Do you think some people just don't have an ear for music and are meant to find something else that resonates with them?,if you want to have it that means you have it. if you don't want it then that's because you don't have it.
Bees?,"great question, no."
why don't you capitalize YO SHIT?,Capitalization is for Clergymen.
When is Summer?,when your half of the planet leans toward the sun.
"Hi Bill. When you make music, do you compose the lead singing first (without any chords), or do you search for a chord progression first? Or something else? May you explain your composition method by text or video some day? Thank you!","always both together. everything revolves around the lead and the lyric, but the chords are Always there immediately with it. then u can hack it out and change the details, but overall it all happens at once. i will do extensive behind the scenes for both writing and production."
which would you rather accept a war request from: Zimbabwe or Uruguay?,i do not accept war requests.
How do I grow up to be like you?,start by wanting to grow up being like someone else. then gradually assimilate those qualities into yourself over time. that's what i did.
"Do you see your videos more as visual crack, pot, or heroin?","i've only tried one of those 3 things, so i don't know."
in your im changing / it's raining music video did it take days to film or did you purposely change clothes in one day?,i do utilize wardrobe changes. that film technique is part of my repertoire.
"are you more of a tchaikovsky, saint-sa‘ns, or brahms person?",i am not really an expert on classical music.
"Hello, it's the internet police. You have 5 'body' tags, and all of those?",s should be.
do you think plants have a conscious?,i think they all actually share the same one.
"what is the meaning of life, also get a web designer or something and upgrade from this basic html shit. love you fam?","if you prefer sites that run slower and have more ads, there are some i can recommend."
What is ur youtube channel?,
Where are your drums?,"in the cases, stacked against the wall."
What is your opinion on capitalism? When do you think it will be replaced?,"WHY HAVE I RECEIVED SO MANY QUESTIONS TODAY ABOUT CAPITALISM, IS THIS A PRANK sorry for yelling."
Have you ever seen a bug fly?,yes.
I know you want to do all your creative work by yourself. That's understandable. But do you realize that means only about 5 (long) videos per year at this rate? What about focusing on the creative part but using some technical help/technical assistance from another person(s)? Many people would love to help you with time-consuming technical stuff so you could concentrate on the pure creative decisions and in the end do more videos (both music and research) until you die. Just let somebody help you so you could achieve more. It would still be your creative work. Please consider this.,i think that will eventually be the way it works. it takes a lot of time to build that kind of trust in someone. right now the only contact i have with the outside world is people sending me emails like hi here's a picture of my cat etc. i also don't make enough to pay people properly for the kind of work i need them to do. in time i think it will come together.
Do you have a facebook profile? Looked for it but couldn't find you teehee :D?,i quit facebook when they stopped allowing me to make up funny towns i'm from.
Cake or death?,no thanks.
Have you found the thing you're looking for?,almost.
"if you were someone else, who would you be?",i no longer want to be anyone else.
You haven't posted any notes on your notebook page in sometime. Why is that?,"it takes a while to search through the hard drive, the phone, and twitter and get all the dates right and decide what i'm going to include. i usually do a big notes update right after i finish a long project. but in the last few years, about 80% of the notes are actually just tweets, so if you follow my twitter you would have already seen them."
Qu'est-ce que tu aimes faire?,"j'aime faire du items and things, etc."
Do you need aspirin?,no.
do you do things ever sometimes?,yes.
are you endorsed by Super PACs?,not that i know of.
What is one piece of musical equipment you are eyeing or striving for at the moment?,more time.
Why wouldn't you find the girl in Houston according to your song write a song on the count of 3?,so far i haven't found her anywhere.
"If you have one, what is your biggest pet peeve?","i prefer not to keep peeves as pets. i believe peeves should run wild, and free."
"I know classical and jazz music theory and I can identify chords in songs, but I still have trouble picking out the voicings. I also find it difficult to voice and voice lead my own songs, especially when voicing multiple instruments together such as piano, rhodes, organ, guitar, vocals, etc. How do I get better with voicings?","i never really figured out what people mean when they say 'voice leading.' i honestly think terms like that are empty and not useful. i find a lot of terms useful, but not that one. just do what sounds good man. as far as getting all those instruments you mentioned to work together, i will say: don't have too many things going on at the same time. and other than that, the only way to learn is experience. always start with less instruments, it gets out of hand fast."
Whne did you do youe onehwork?,the class before.
"i know history seems your forte, but do you know enough about japanese and/or egyptian mythology to ever make a video or two about them?",history is not my forte. i apologize for the confusion.
what's wrong with punk rock?,
if people gave you a shitload of money would you immediately make more history videos?,it has already happened multiple times. i said no every time.
How did you go about learning from songs? Did you play by ear and imitate? How do you get good at getting good?,"it's kind of like playing hide and seek. each time you get better at finding the person, until eventually you know where they are every time."
What are you trying to say in your music?,that i am legally allowed to make music.
Can you answer this question in the most complex way?,"there is no most complex way. complexity has no limits, at least not that i know of."
Do you think that there's a better alternative to capitalism?,"yes, but it will have to sell itself."
"Do you know how to code? If so, in what language? (C++, Java, et cetera)?","i barely know the amount of html i use to make this website. i also know most of the mac keyboard commands (copy, paste, etc)."
Are you on reddit?,not sure if i understand the question.
"Alright then, where do circles begin?",which circle.
"How do you feel when I tell you that you're a great source of inspiration and motivation to me? Do you get a big head, do you think that's normal, or is it hard to understand, or something else?","i think it's the reason i'm doing this, and maybe i'm finally on the right track."
Do you plan to do more History of ____ videos? Or even just longer videos in the future?,yes.
how do you write such a shit load of good songs?,"write a lot of terrible ones, and then wait for people to be mad at you for them being terrible. that might not be the best way, but it's the way i do it."
Do you use snapchat?,no.
Are you a potterhead?,no.
What is the last anime you watched?,i've never watched anime.
Do you think money is an acceptable reason to produce art?,sure.
what program did you use to harmonize the weather lady? I'd love to get my creative juices flowing again and do some stuff inspired by your videos!,no program. came up with the entire arrangement before i recorded it.
what comes first : ethics or awesomeness?,try to get them both to happen at the same time.
hey my dude?,what's up.
"The actor John Gielgud believed that of all Shakespeare's characters Hamlet is probably the one most like Shakespeare himself - since, of all Shakespeare's characters, only Hamlet can be imagined to have written all the Shakespearean plays. How good an understanding of Hamlet's character does Gielgud's belief reflect?","pretty good, i assume. the guy seems to be a huge fan of shakespeare, and also seems pretty thoughtful, so i trust he knows his shit."
Do you answer existential questions?,have you read this page.
What's your favorite font?,braille.
"which came first, the chicken or you?",depends which chicken.
Do you answer all your fanmail?,no.
"If you could name the next element on the periodic table, what would you name it?",it really depends what it is and does.
"Why don't you live in the UK, we'd be bffs :(?",because i was born in america and it is difficult and expensive to travel across Oceans.
how do you website?,"make html pages using text, then save them in a folder.  then you have to buy hosting and a domain name, and get an FTP program to upload the files to the site. simple html is actually really easy, you can pretty much just copy from examples (from sites like w3schools) and change things until it's what you want. that being said, if you are learning things by yourself and doing it from scratch, the website will probably look like it was made by a 13 year old in 1997."
wHY ArR YOU IN LOve withME?,because you are extremely dedicated and devoted to whatever it is that inspires you. that being said i have no idea who this is.
Do you ever get nice fanmail?,yes.
Do you like watching people popping pimples?,yes! just kidding no.
"When this question will be answered, and also are u answering this question?",now (8:25pm) and yes.
Would you ever make videos where it's just you sitting and talking to the camera?,"i've made thousands. but in order to ensure they are interesting, they will need to be jump-cutted and annotated heavily."
what's your alma mater?,sorry i don't understand latin that well.
Do you have something else to do other than answering questions? #Priorities?,yes.
I will remember you. Will you remember me?,how would i know who you are in the first place if you don't tell me.
What's your favorite Video Game?,
Where'd you learn all your stuff?,
"Turn YouTube ads on so I can help you make money, you deserve it (& I don't mind)?",ads are cancerous. if you want to.
What makes you you?,me.
what's your favorite memory?,
what is your favorite drink?,water.
What is one song you've listened to in the past month that you enjoyed?,
Can I start a religion or secret society in your name?,no.
Whsts your opinion on dank memes?,keep an open mind. you never know what could make a meme dank.
ok so what is being then?,it is what it is.
Have you considered mutually beneficial cohabitation?,"absolutely, i think that would be very good for me."
May I use your songs (not-for-profit)?,you'll have to give me more details about how.
"need a history of australia matey, compared to japan it should be pretty short?",
"Do you think that your strong desire to finish all that you do (songs etc.) is dictated by the system, which institutes productivity as a god tier value? (you are free to use your life as you want to, and not finishing things is no big deal)?",it's probably similar to the reason women usually want to finish making the babies they've started.
Where do you find creative inspiration ? How do you cope with the lack of it ?,"it finds me. too much actually. i need some of it to go away, i don't have time to finish it all."
"Why did you make the History of Japan video? Was it for a school project, or just for fun? Why?",
what will you do in 2026?,another tour.
How do you feel about living in capitalists society?,it's a deal.
Can I give you money for more video!,
Can I get a black slave?,i find it's best to be your own slave.
Would you hire a Samurai? Ż\_(ツ)_/Ż?,
Where would you like to live if you could move anywhere? What country do you live in now?,
Do you have a job outside of music?,no.
What do you think when people think you've stopped making videos because you haven't uploaded a new video in 2 months?,i think do they know the last one took 3 and a half.
has anyone not asked you this question before?,"yes, everyone."
You remember when Wonka went down the tunnel? Tops?,yeah. scary as fuck.
Do you like pasta?,yes.
Do you find yourself trying to make everyone happy? If so how do you check yourself?,all the time. i try to remind myself.
"do you feel that history of Japan is your best work, or could you have done better?",neither.
please make me understand?,i am trying.
How do you plan to make the world not be terrible?,"there need to be some huge breakthroughs in communication and transportation, on a global scale."
I go back to school tomorrow. What do I do?,"find productive stuff to do and think about during class, so the time is not wasted."
Are you still alive?,i will check.
thoughts on CGP Grey?,love him.
do you watch doctor who? If not - why aren't you watching it right now? if yes - who's your favourite doctor?,i am not watching it because i am BUSY MAKING COPIOUS AMOUNTS OF CONTENT FOR THE ONLINE COMMUNITY.
whats your opinion on cheese?,"it has strange properties, and characteristics."
"you seem nice. sorry that wasnt a question, are you nice?",i will check.
Would you rather only taste watermelon for everything you ate for the rest of your life or have to go bowling every day for 6 hours for the rest of your life?,"taste watermelon. in some countries everything tastes like poo, so watermelon would be a step up."
"You're an absolute madman, you know that?",the correct term would be madperson.
Did you know?,depends when.
what is wonderfullest right now?,the world.
"What is the reason for the random misspellings throughout your page? Just whimsy, or to evoke a certain feel?",i'm not sure what you mean. page do you mean this entire website? just the questions page? twitter? do you mean the titles of the pages on this website? the notes? song titles? there would be different reasons depending on which thing you are referring to.
any thoughts on pope Urban II?,no.
"If I mailed you a cat, what color would you like it to be?",i don't want a cat. it's not a good idea to send cats through the mail anyway.
WHERE DID YOU GET THE SOUND EFFECTS FOR HISTORY OF JAPAN? :))?,"they are all musical. i played them. except for recognizable sounds like the doorbell, school bell, door opening, ocean waves, sword noise, rap airhorn, etc. but all the bings and bonks and tweedles and the entire soundtrack was composed and played musically."
Legos or megablocks?,not sure if i understand the question.
what is the country you have the most interest in visiting?,i need to do it in a certain order. england needs to be first.
Where would you be in a crowded room?,likely somewhere between the floor and the ceiling.
"Good god, are you answering EVERYONE'S questions???",no.
"Bob Dylan, Louis CK, and Andy Kaufman each stare at you drooling at what you're gonna do next. are you gonna screech nails on a chalkboard or puke the alphabet?",no.
pineapple on pizza - yes or no?,not sure if i understand the question.
In a few of your videos I noticed you used the colour blue. What metaphor does the colour blue mean to you?,blue symbolizes the republican party (GOP) in america. or actually maybe it's the other one i forget.
Can you do an arrangement of my own rendition of Central Park West?,i already did central park west. no time to double up.
how do i go to space?,"you have to leave earth's atmosphere using #Rockets. that may seem difficult, but trust me, getting back is more difficult."
why does my dad come home late at night?,"perhaps he is partaking in either business, or pleasure."
"Err.... where can I ask a question, again ?",
