question,answer
How do you feel knowing that so many people love and support you that you have never even met?,it would be great to meet them all. but it can be overwhelming.
"how do you deal with crushes? are they good, bad ,do ya get rid of them as soon as possible or let em fade?","i have no idea. last one i had was devastating for me. it was so intense, and it didn't work out. i have been very cautious ever since."
I can't find inspiration to do.....anything??? what should I do to find some?,clean your room.
you put an insane amount of work into your videos and I dont think people really appreciate it. you synchronize video and audio in hilarious and unique way. what kind of musical and compositional training do you have or are you mostly self-taught?,entirely self-taught.
how did you learn to make music?,by doing it.
do you generally enjoy life?,absolutely. it is the best thing that ever happened to me.
what is the best way to write a dream journal?,1. have dreams. 2. write them down. 3. (optional) help your friends write dream journals.
Any new History of _____ episodes coming in the future?,
is this questions page meant to be serious or not really? is it just more fun to type weird answers?,that would depend on the question.
What did you learn at the awards?,i learned how anti-social i truly am.
When I'm sad and down I listen to your music to cheer me up. What else do you recommend to help cheer me up?,investing in rare metals.
Can I be your friend?,
what were you doing five minutes ago?,trying to figure out which side of the bed to get up on.
how to do deal with ongoing existential crises?,document your journey.
"I feel like garbage, what I should do?",start thinking of all the things you are going to do when you feel better.
What's the spookiest thing that's ever happened to you?,was born.
Do you have thoughts?,"oh yes, probably too many."
Do you prefer eagles the band or animal?,i think they are both doing a great job.
anything interesting happen today?,"yes, the sun came up, as a brave and bold gift of love and life to the entire planet."
Has anyone asked you a question about having asked a question before?,"yes, it is a popular topic, i think particularly when people can't think of a question."
"did you ever check out this website this cool guy made to let people ask him questions? you should try it, links at http://www.billwurtz.com/questions/questions.html?","yea, the guy's a fuckin jerk. he won't even answer my questions. i've been trying to ask him what his favorite band is for weeks. it's like he doesn't even understand the question."
do you hate watercolors?,great question. no.
i miss you?,i miss you too.
what is your advice for people with eating disorders?,"try to develop a completely different disorder, if you can."
"you strike me as a google guy, rather than a bing guy. which do you prefer?",was not aware bing still existed.
Who am I?!,"a magnificent and wonderful person, i assume."
what is the first conspiracy theory you think of... right now?,evil.
what are you currently working on?,questions.
"You're awesome at writing music, but I love the way write with words too! Have you ever thought about writing a book/poetry? You know, in all that free time you have.","i think generally it is best to use words, music, and visuals together as much as possible. although i do have two outlets for words only: the."
Why is eye contact so hard for me?,it is probably due to your thoughts and feelings.
What does it mean when you leave answers to certain questions blank?,
did you have some kind of music education?,"if that means learning, then yes."
what are your thoughts on shoehorns generally?,i think it could be a real game changer.
What do I do if I want to be funny but I'm not and I can't remember jokes that well?,i think you are on the right track.
"How do you remember which questions people have asked you multiple times that you can refer them to, since you receive so many questions?",when i get one i've gotten before it gives me a certain special feeling.
What are your thoughts on Arkansas?,
is advertising ethical?,i'd say it's about as ethical as life on earth in general.
Has anyone asked you this question before?,***BRAND NEW QUESTION AWARD***.
can u answer emails like faster? ive sent like 4 in 2 days and got nuthing >:(?,check the address. i haven't gotten more than 1 email from anyone in the last week.
a villager in my animal crossing town is asking me what nickname I want to go by. any suggestions?,"i dunno, jordlf?"
"If you were told the planet is going to die in a decade and only scientists are allowed on escape space shuttles, why would you stick to making awesome videos?","because they are going to need cool videos on the space shuttle. (i am a scientist, so i would get to go on the space shuttle)."
How far are you on your next project?,"well, the thing i've been working on for the last 3 months which is a totally underground autobiographical archeological side-project, and possibly a big waste of time but still for some reason very important to me, is probably about 90% complete."
Why do you not use capital letters?,"Hi Geoff,."
Where is Japan?,i have no idea.
"Do you play video games? If yes, what game  do you play?",
Have you thought about if all of these questions (except for this one) came from one person?,
any tips on how to get started making music (software and on a piano)? also how to make your pretty text animations?,"you have to start with the nearest, easiest, and most familiar tools available, and start experimenting in any way possible."
How are babies made?,they make themselves.
WHAT IS LOVE?,
"could you consider making a history series? It doesn't have to be that accurate, as long as it is entertaining?",
mbti type? (entp?)?,
what do you think of vegans?,"i have many vegan friends, and let me just say, i think they are wonderful people."
Where is your mind right now?,probably in paradise.
"If you could press a button on some software to automatically compose good music, would you? Or is creating it all the fun?",depends what you mean by good.
Where do parents come fro?,more parents.
do you not like talking physically to people?,"no, i don't not."
Chocolate is to cheese as chess is to checkers. Explain.,i disagree.
When is your next video coming out!!!? I can't wait any longer!,
Whats your favorite snack?,"ideas, and concepts."
how are you feeling?,good.
Any tips for getting through high school finals? pls help?,you're asking the wrong person. i did not do well.
Trump or Clinton?,too soon to predict.
How long does it take you to make a YouTube video?,depends which one.
when you wrote i'm sad were you actually sad?,no.
where are you?,pyongyang.
What's your favorite book and would you recommend it to a friend?,the phone book. i would recommend it to anyone seeking an efficient resource for accurate and up-to-date contact information.
how do we stop war?,acheive collective consciousness.
I had an idea for a music making strategy: stop listening to music. The motivation is that liking music can be distracting. What do you think about this?,"i tried that once. it didn't last, and i don't think it helped."
what is your favorite letter?,which ever ones are used in the word i am spelling at any given time.
"i'm trying to make a solo piano cover of the road, but i'm having trouble telling what the chords around 1:03 are. Is this ok with you?","starting on the word go, i think it's Dbma7, C#min7/B, Cmin7/Bb, G#min7/F#. so all 3 of those chords in the transition would be the same chord. let me know if you have any more questions. i hope you see this before people start asking what my favorite chord is and i'm forced to murder myself."
I find it incredibly difficult to interact with others. Part of me really wants to accept loneliness as it is the most comfortable lifestyle for me. How did you accept loneliness as a lifestyle?,"i actually didn't want to. i found it extremely scary, and tried to be around other people as much as possible. but nobody really wanted to spend that much time with me, and it always felt like no one was really going in the same direction as me. so eventually i realized it was time to get serious."
Do u love me?,
how long did it take to write your shorty award speech?,i actually plagiarized it.
Do you believe you have some form of autism? I don't think you do but that's just me.,"never received a diagnosis, but everything i have read about it seems extremely, extremely familiar."
"have you generally found the workflow to be more straightforward to compose music first and create the video afterwards, as opposed to creating a video and then scoring the music to that? also i love you and i'm happy you're working on what you love for forever?",it depends which video.
How do you get notifications on your phone?,if you go into settings you should be able to turn them on for each app.
any advice on how to stay sane?,"think about the nearest ocean, or other major geographical feature."
What kind of musical background do you have?,experimentation.
"idk if anyone has asked this before me, but do you read the comments? or have you read them or will read them? etc.",what comments.
Do you have a timeframe you always complete your projects in?,i aim for 5 minutes.
Are you a type A or type B personality?,"from what i understand, there are infinite personality types. not sure where A and B would fit into that."
AAAAAAAAAAAAAAAA?,you make a good point.
"If doing your passion is fun and enjoyable, does it ever feel like work to you?","sure, sometimes. but if it gets really bad that's often a sign that you are going in slightly the wrong direction."
who are you?,i will check.
How many spam questions do you get on average per day?,0.
Favorite animal?,
"do you believe that the best art has to come from genuine feelings? that is to say, does it matter if I don't feel particularly inspired one day, or can I create something that inspires emotion in others even when I have no emotion myself?","feelings help, especially when breaking new ground, but if you have your skills in good shape it is possible that you may inspire even on a medium day."
do u have any advice for someone who is afraid of dying and afraid of the fact that the universe will eventually end?,you were probably afraid of dying in your previous life also.
Is this question page sustainable for you?,great question. yes.
Do you currently only answer quick questions which don't require much thinking? So u have more time to work or something?,no.
what's something I can stop worrying about for good?,the unibomber.
What one piece of advice would you give to become a more productive person?,"know exactly what you want to accomplish, and know the exact steps."
Do you believe there is an inherent meaning to life? Or do you think life is ultimately meaningless but that individuals should find their own way of making their life mean something? Thanks?,
why do you think that some concepts are really deep and some concepts are really simple or at least appear to be? what makes it so concepts are some certain amount of deepness or simpleness? sorry if this is a bit unclear?,if you go to settings you can adjust it.
Any advice on how to go absolutely crazy?,go to Earth.
Congratulations on your award my friend. How are you holding up?,"it is very heavy, and difficult to carry around everywhere i go, but i am doing ok."
is art what you make?,i will check.
why?,to try.
Godzilla?,i don't think godzilla is a question.
do you ever struggle to find inspiration?,not really. the real struggle is how to express all of it in my lifetime.
have you ever written music?,yes.
do you pronounce gif as gif or jif?,i have never said it out loud.
How to be in college but still be productive and work all the time on things I care about? (music)?,"if you don't go to class, that will free up a huge block of time right there."
how are you doing with your work schedule?,"really trying to speed things up, as always. drowning in this journals/improvs project. very eager to wrap this up and get back to new content."
Vomit. Thoughts?,"great question. i think most of the time vomit would not be considered thoughts, although it does posess some similarities."
do you think that gender and race are socially constructed?,no. they already existed before.
"do you ever feel like it's just better for you to just kind of wait and listen, like you're not really sure where or how to fit in?",
what do you think about the internet?,i think it's off to a good start.
are you aware of the existence of capital letters?,are you.
What is important in life?,the element of surprise.
"hello! comedy is often used to combat sadness. please, tell me a joke!","Hi Steve, it was great to meet with you today. Let's plan to follow up sometime next week."
what is the most important lesson you've have learned from parrots?,that parrots exist.
did bush do 9/11?,"yes, and he is still doing it."
"will you make more of the history of ... videos?I read somewhere in your other video before you uploading the history of japan,you said you are preparing new video in the last 4 months?is that how long you make the history of japan video?if yes,will it mean there's still hope for another history of ... videos?sorry for bad english,also please try not to die before finishing atleast 100 history of videos,if you die bfore finish that 100 videos I'll kill you to death!im not joking,thx?",
What is your favourite genre of music?,
How do I work harder without feeling like I'm missing out on things? Do you have any advice on gaining focus? P.S. It's a 9.9 recurring/10 for your Work so far!,"gather experiences for as long as possible, and then just when it feels like you're life is starting to run out, start working and never stop."
Favorite Meme?,crime.
do you have a favourite mainstream artist whom you either listen to for recreational purposes or even for music inspiration?,no.
"Do you mean to answer these questions in such a snarky way, or are you just trying to get through these quickly?","perhaps my mind is melted from receiving so many of the same questions over and over. sometimes i melt the answers, to make it more interesting."
Will you ever make another youtube video?,(donald trump voice) billions.
how are social norms your favourite memes? you don't seem to conform to them and this is unrelated but personally social norms are 100% my least favourite memes?,"for those of you just joining us, the word favorite makes my mind implode. i usually either refer favorites questions to the."
Do you like me? CAUSE I LOVE YOU?,who is this.
"Without being heavily influenced with contemporary trends, how did you define a clear creative direction?","have severe writers block for 5 years, and then finally lose your mind and pick up a piece of paper and just start writing rabbit snakes and see what develops."
new canaan is my favorite song right now. what inspired u to write it?,taking a train to new canaan.
Is there any deeper meaning behind or work? Or are you just doing it for the hell of it?,i'm testing to see if the internet still works.
top 5 cereals?,
Are you ever concerned that people will stop caring about your work because of your lack of uploads since History of Japan?,"i can't keep going through life wondering when i am ever going to be able to release all the improv and journals i've accumulated over the past several years. i apologize for the delay it's causing, but if i don't take care of this now it may never happen."
"I feel as though your way of making music, constantly and through any circumstances, is a lot different to other musicians. Do you ever feel forced into constantly making content, or find yourself with musicians' block and unable to create anything of substance?","after spending all of 2012 and 13 writing, i have more material than i would ever have time to record."
"Aside from ur wonderful Japan vid, would you ever make another vid/vine that isn't solely musical?","of course. i have made many in the past, and will do many many more in the future."
"in order to maximise originality, do you avoid listening to or watching other people's work? You seem to place a large focus on doing what other people don't do, so surely seeing other people's stuff would affect your subconscious? Thanks?","i think you're right, but the real reason is i don't have time. i do make an effort to keep up with popular radio, but if i want to succeed at what i'm doing it requires full time hard work, so that's the more realistic reason why consuming of other content is sometimes neglected. if i spent my time watching other peoples' content, you would see much less content from me, and there is already not enough, in my opinion. i hope that makes sense."
are you afraid of dying?,more afraid of being born. whoops already did it.
How many friends have you made since you opened your email for fans to talk to you?,(donald trump voice) billions and billions.
What is your favorite kind of bread?,SUPER BREAD!!!!!!!
do you maintain the question section because you enjoy it or is it for us?,"i think it's a good learning experience, mainly for me."
what is your favourite meme?,social norms.
how to get your crush to love you?,be yourself. don't even think about trying anything else.
What's your opinion on freedom of opinion?,i think it includes not having an opinion.
Why did you choose Japan as your first historical musical?,
do you only answer the questions which you ask here?,great question. i don't ask questions here.
buts or boobs?,"the entire mind, body, and spirit. thanks for asking."
what part of french do you speak?,the part you learn in american highschool.
what is your favorite band?,rubber.
If you were going to make a new letter of the alphabet. What would it be and why?,dr. seuss has covered that subject extensively. i have nothing additional to offer.
How often do you have existential crises?,a long time ago i had one that never ended. i just got used to it.
Where do you live?,turtle island.
is there a chance that you'd still be romantically interested in someone if they did not have good math skills? asking for a friend?,who knows. anything's possible.
How do you make your money?,as a hired musician.
how long did it take you to make the japan video? love from finland?,
in some of your short music jingle videos you repeat the content twice in the video but other times you don't. is there a pattern of some kind to this?,"all the videos from late 2015 were written for Vine, which loops the videos automatically. some of them were written as a seamless musical loop (letterman, have a good day, etc) because that's a good way to take advantage of the looping platform (many vine musicians do this). in order to not deprive the youtube viewers of the looping experience, i sent the loop around a couple times, and sometimes even added a special ending for the youtube version only (i.e. letterman)."
okay i know you have a yes video and a no video but did you also make like a maybe or i don't know? or did i imagine those?,
Are you tired?,no.
is music really a language?,it communicates feelings more than information.
"i am, new. trip, i am ,  new trip. i am, the colors are insane. is this about an acid trip? the answer is either 'yes' or 'no'?",great question. no.
What kind of sports do you enjoy?,the one where you try to make each other lose.
"Hey Bill, what's your favorite movie?",the first one.
Boy you get some dumb questions here don't you?,i think the proper term is gifted.
Will you be making another history video similar to 'the history of japan'?,
When Will You Do The Next History Of A Country? Really Waiting For That :)?,Right When You Least Expect It.
When are you uploading your next YouTube video? We miss you?,2016.
Today's society likes to have everything in starkly defined boxes. You seem to like for concepts/things to have a more abstract definition. Do you have any comment for how society raises people to think a certain way?,"defining things is an important human skill. such as is this food or not food. i've noticed that it can get a little out of hand, only in 1st world countries.  nobody living in poverty is worried about what kind of food their food is considered. they just care if it's food."
what is your favourite thing in the world?,the sun.
Have you ever struggled with fuck why is everything fucked?,"at times. it is an important issue, and i think it is a common theme in this world. in general i have been much better off ever since i figured out what i'm doing with my life."
Have you thought of making music that combines 2 or more odd genres of music? Perhaps smooth jazz and metal.,genres are a hoax.
Do you dislike categorising things?,i would say that's a basic class A no.
Have you ever struggled with depression or anxiety ?,not much.
"Do you consider yourself an artist? Would you be comfortable in seeing your work admired, analyzed and displayed?",so far it seems ok.
Do you find this question section be a bit therapeutic?,"yes, in a bad way, which is good."
"Do any of your songs remind you of other non-auditory sense impressions? Like, is there a song that makes you think of a color, taste, smell, or texture?",no.
How do you organize your thoughts?,discover the way they were originally orgnized. that's the only way they are going to work.
What font do you use.. Helvetica? and why?,"i used to worry about different fonts for everything, but that became not only a waste of time, but also distracting from a viewing standpoint. i ultimately made a decision to actually use the default font for everything. it gave me a lot of creative clarity, and greater efficiency. i learned it's better to focus on your strong points, and don't worry about things that are not your strong points. i don't make my own fonts, and i don't have access to a large font libary, so this would not be a strong point. by religiously using the default font only, i found that i could instantly put all my focus on things that are my strong points -- positioning, angles, motion, and timing."
you have sheet music available for some of your songs? where?,"just the original writing, not a transcript. so in many cases this would be years before it was recorded, and might not include all the detail as the recording (and might even have changed on the recording). they would be on the expert page, and most of them are probably from 2010 or earlier."
what even is a question?,a request for specific information.
answer: yes?,now you write the question.
Trump 2016?,i think it is likely.
"Besides English and possibly French, do you know how to speak any other language?",music.
What happens if I introduced myself to you but I have received little to no response from you?,"if all you did was introduce yourself, i might not have known how to respond... because you already know who i am. i find when people jump straight into the big issues, pretending they already know me, it works very well. i'm sorry, maybe i have some kind of mental condition, but to be fair you probably already noticed that from some of the material i have released."
Why do ads ruin your life when u see them ?,"because they are twice as loud, and they talk to you like you are a dog, and it's the same one every time, which is based on a google search you did 6 months ago."
what's your favorite kind of season?,different.
What makes you laugh?,business suits.
What languages do you speak ?,
how do dreams work?,"you stop accepting input from your eyes, ears, etc, but your mind keeps running. so that means even the smallest tiny little bits of input (thoughts, memories, etc.) can manifest into realities. but because they are not actual sensory input from the solid outside world, they are prone to wild transformation on a moment to moment basis."
do u like clams?,never had one.
What would you do if someone gave you lemons?,"not currently accepting lemons, i apologize."
Why didn't you monetize?,"because ads ruin my life when i see them. the least i can do for the viewers is not subject them to the same torture. people come to my page for the memes, the jokes, the music, the ideas, who knows what, but they don't come to be repeatedly tortured and taunted into buying stuff."
how far do you have to look back in your past work to start finding it embarrassing?,about 6 months.
in the sheet music of i like there's a second verse so i was wondering why it ends after the oh damn yeahs instead of continuing?,wow i totally forgot about all of that. guess i must have made an executive decision in the studio. probably thought it was stronger to wrap it up there.
is it okay that i ask almost more than three questions a day here?,i think that's great. i'm sorry if i haven't been able to answer all of them. feel free to introduce yourself if you haven't already.
why.,
do u ever write poetry?,"i understand that poetry has strict rules and regulations, but i would assume at least something."
modern medicine: fact or fiction?,murder mystery.
isn't it ironic how i like alanis morissette i learned the word from her?,"hey what can i say. you live, you learn."
who is the best?,"you, duh."
"Aside from answering questions, what are you doing right now?",fighting the war on terror.
whats your favorite kind of pie?,cutie.
did you ever get bullied in school bill?,the bar has been constantly lowered for bullying. nowadays i think frowning at someone is considered bullying. so yes i was bullied.
what happened to verse 2 of 'i like'?,that song doesn't really follow verse-chorus form.
would you ever consider befriending one of your fans?,absolutely. especially if working 24/7 on a lifelong creative endeavor seems relatable to them.
