question,answer
What is music?,"mainly a hypnosis tool, used for propaganda enhancement."
yo bill what program do you use for animation?,"it doesn't matter. i'm just using the most basic functions anyway, nothing unique to the program. also the program is discontinued and doesn't work on new computers."
what is the number you use the most?,1.
Can you do the thing with the other thing that causes the stuff to affect the main object?,that's like ... the main thing i do.
what do you think is a word that u use the most?,of.
"hey Bill,have you got a name for that classic soul progression that goes VI-V-Im-VIIm-III-VI-V -Im? Like just the two of us or if you want me to stay (but in this case already beggining in the root), and have you ever heard any nice twists to it?Keep up the good work! Love you?","i don't have a name for it, other than to say it's the good old 5min to set up the 4 except it's used from the perspective of the relative minor. so like, if you're in a minor key, it's when you go ahead and smack the flat7min7, to set up the b6.  honestly, a pretty slick version of this which you might get a kick out of, is in the verse of 'let me love you one more time' (benson). and then there's obviously biggie's 'big poppa' which i believe is actually just isley brothers. also check out the second verse of a song called You by mya, on the word grow. this one has the extra passing tone thrown in for bonus points. Also, another twist i just thought of -- a lot of songs do like a 2-5 and then another 2-5 a whole step lower -- so it actually kind of has that same effect when it hits the 2 of the second 2-5-- sounds like the b7min7. example of that would be c'est la vie by robbie neville. 'love' by musiq does another one chromatically in the verse, but the melody doesn't obey it as well as the 'mya' example.  here's one that may seem subtle -- there was a mariah carey song (maybe 2006??) called 'shake it off it's really just 3 chord hits, but it implies the same thing. t-pain 'show you how' also uses it pretty quick. also 'luv' by janet jackson uses it very expertly, with a gold-plated tritone substitution thing for the inbetween chord. basically all these are the b7min7 (to usually set up the b6) from a minor key. hope that's what you meant, i'm just taking that as the main common thread between your examples. ultimately this is a good technique, which i bet not many people know nowadays, and it is surely a great way to get chicks."
How do you create your animations?,basic motion and keyframes. it's hard work unless you keep it simple.
Do you censor these questions?,fuck no.
"have you ever considered making a list of lists so we can conveniently see the frequently asked questions and answers in a single convenient hub, so as to avoid asking you the same things?",it's actually pretty easy to see if a question has been asked. just cmd-F (or ctrl-F) to search this page. just search for the main word in your question (like eggs) and press cmd-G (or ctrl G) to jump through the mentions.
"how do you deal with the: oh, this chord feels nice. oh, this one feels better. oh, this one is actually better than the two before. oh, this one is kinda in between, etc. whenever I'm making a song I can't help but think whether the chords I used were the best. Have you ever felt like this?","yes, absolutely. i will nitpick every little thing, often even how loud to play each note of the chord. there's basically 2 solutions: worry about it forever, or stop worrying about it Now. after you stop worrying about it and put out a couple (or a hundred)  really sloppy songs, you will eventually realize you are bulletproof enough to venture to worry about the chords just the right amount. but you will never get there unless you lower your standards enough to get the machine moving. also, plot twist, if you really are as sensitive as you say you are, even your sloppiest version is actually going to be pretty great."
"So, you think walls are a hoax... What are your opinions on doors? (I haven't seen your opinion on doors yet and I am curious)?",are you kidding? half my material is about doors.
"But bill, your the wind beneath my wings. Marry me.","i don't have time for jokes on this subject. i am a very lonely person. if you think you and i are compatible, for fuck's sake send me an email and tell me about yourself. i am desperately looking for the right person. taunting me on a public page with nameless marriage proposals is not constructive."
Can we get married?,i think that may be rushing into things.
"out of curiosity, are you into the vaporwave aesthetic trend because I heard all your instrumentals and they were rad af?",trends are for losers.
Does this thing actually work?,let me check.
im sad and i dont know how to stop?,well where did you learn to do it in the first place.
"Notice you don't really use a guitar in your compositions? Any specific reason why or just preference? Maj 7, Min 7, add 9, add 7 chords can all sound really groovy with the right tone :D?","i love guitars just as much as anyone, but when i make records it's all midi. a midi-only approach is the only thing that makes sense for me. i've been doing it since i was 10, and it is a drastically more efficient use of my particular skill sets, and also given the fact that i'm working by myself."
"Out of curiousity, what made you pick Japan for your first long video?",
"Hi Bill, can I help you remove some songs from your list of songs to cover? My suggestions are More Than A Feeling by Boston, Separate Ways by Journey, and Lithium by Nirvana. I think you could do without covering those songs, as you had originally planned. What do you think?","honestly, i really appreciate the help. the 1st two were actually not on the list, the 3rd one is. but i don't think i can get rid of it, lithium is a very strong contender. it has a lot of potential."
are you going to continue making short videos?,"i would like to do as many different types of things as possible. in the past 2 years (actually 10 years) i've had to do much more short stuff than i wanted, because it was really the only way to get off the ground. i hope to correct that balance a bit-- i would like to do things of every length. 40 sec, 1min05 sec, 3min15 sec, ... all the lengths are great, and should be explored."
Make an evolution video?,ok.
Do you think you can cover You Suffer (But Why?) by Napalm Death in your own style? Give it a listen.,"i have been compiling a list of songs i want to cover. there are about 800 songs in the list. every song in the list is one i desperately, desperately want to cover. only a few of them will ever get done. at this point i need help removing songs from the list, not adding them."
Would you make a video about the History of France ?,
Can you make a video about the History of India ?,
Date tonight?,sure.
was it difficult for you to go to the shorty awards? you seem like a super private person who would want to avoid attention like that at all costs.,"i was considering skipping it, but i knew i should go to get some experience dealing with that sort of thing. i learned a lot."
Can I slide into your DMs? If you know what i mean?,my twitter app only allows 140 characters in DMs. so everyone's messages get cut off. all my messages look like: Hi Bill. My name is Gustav Jorbelson. I work for a Production Company specializing in forcefeeding content to millennials and I was wonderi.
what do memes mean to you?,i don't even know what a meme is anymore. i think they changed it.
history of poland? such a great country to make a video?,
What is your favorite favorite?,
what type of car do you drive?,a race car.
What do you think the alternative universe version of you is doing right now?,which one.
do you think all the numbers have been invented?,"numbers aren't invented, they are discovered. and they have not all been discovered."
you said it took 14 weeks to complete the history of japan video. was that 14 weeks of nonstop working on it or sort of on / off type of working?,"non stop, but i was also doing vines 7 days a week for most of that time, which really slowed me down. i finally quit doing that in order to move faster."
"i keep checking your website everyday for your next project. are you getting closer, or further away from a release?","i've decided it's not the kind of thing that i can release by itself. i don't want people to think THIS was the big project he was working on this entire time? what an idiot. instead, i want it to be like a huge archive of bonus material that's just sitting there on the back page waiting for people to stumble upon it.  i've decided to wait until the release of the next big real project, and put it up at the same time. also i am very concerned about people putting it on youtube, because the dates would get all messed up, and i also don't want it going viral.  that's why i've decided to sneak it up there at the same time as another big/real project, to distract focus."
how do you listen to music?,
what doesn't exist?,the fung wah.
"history of sweden, if it's not too much trouble? do you think you could make a video similar to history of japan for sweden? it's a pretty wacky country, so I've heard! your other videos are lovely btw?",
"Hey, so I'm on your channel for kinda long time, and seeing how your video about Japan gets so many likes  is, like, uncomfortable for me. Do you feel the same? Do you think it's weird that so many people loved your random crap? Don't you want to keep your channel as a small thing for a nice appreciating clique?",i've never fit into any clique. i want to connect with everyone in the world who feels like they don't fit into any clique. this is ironically more people than you would think.
Do you think having favorites is a bad thing?,u mean do i judge people for judging things? fuck no.
"I was reading this article on something the author referred to as Bartok substitutions, which are dominant subs whose roots are part of the same fully diminished chord as the V7. The tritone sub and the bVII7 sub got good reviews, but the remaining III7 sub is supposed to be the one that doesn't work so great. I know that Rachmaninoff used it, though, as a way to deceptively resolve to the relative major of a minor tonic. What are your thoughts on this III7 dominant sub?",seems legit.  verse of 'don't dream it's over' does that. chorus of 'sk8er boi' also does it. and many more examples i can't think of right now.
how do you wake up from a dream?,try to stay in it as long as possible.
"Is BABIP truly something which universally will reside around .300 given equal quality of defense, or is it just that pitchers who make it to the major leagues will in general need to have the contact suppression skills to maintain a .300 BABIP against?",both are contributing factors.
Do you ever go to sleep?,i try to do it at least once a day.
why aren't your youtube videos monetized?,"monetizing a video means: before you see the video, you have to hear someone talking to you twice is loud in a tone of voice best used on 5-year olds, trying to convince you that you desperately want something you googled 6 months ago."
hey bill. i was here a few weeks ago and i felt really bad and asked some questions and now i feel better. thank you. my question is how are you focused all the time. i have a lot of ideas and projects i want to do but i'm really bad at actually doing them.,this is normal. time will go by and you will want to do it badder and badder. eventually you will become so desperate that you will be forced to find some kind of path to get there.
will you ever make more history of .....,
what is reality?,a fun challenge.
"If you could meet anybody in the world, who would it be?",everybody.
do you feel pain?,"yes, and see it."
"You answered my last question (about adopting me) asking who I was. I am your long lost cousin, Prince Simon of Africa. I was recently deposed by a corrupt General and need some help getting money out of the county. Will you help me?",you can find cousins more efficiently on craigslist.
why don't you have favorites?,"the whole idea of favorites seems fucked to me. there's infinite things, and they are all so different and unique. it would be a waste of time to even think about saying one is actually 'better' than all the rest. as soon as you acknowledge one thing's greatness, another thing will immediately gain value as a contrasting 'answer' to the first thing."
Why are you guys are from (got the impression there are more than two of you guys)?,"i am one person, and i am very lonely."
are bears dogs?,not usually.
Do you think doing exercises or warm ups on an instrument is useful or just a waste of time that's better spent on learning and writing songs?,i generally advocate combining it all together as much as possible. although i guess it depends on your instrument.
"In relation to the Bernie Madoff scandal, would U.S. finance regulations have had more chance of identifying the specified fraud if section 2 and section 4 of the US Corporate Governance Act had been enacted ahead of 2006, notwithstanding the proposed amendments by the United States Securities And Exchange Commission?","in the big picture, it really wouldn't have made a difference. bernie madoff was just one of many, many, many people, engaging in very typical and normal behavior: trying to get and keep as much money as possible, using any means necessary."
do you believe in life after death?,it could go in either order.
"Ok, if someone made a new genre of music called Dogstep. Would you listen to it?The music would have same base as dubstep except for the fact that instead of music and beats dropping, it would be a compilation of dogs baking at different frequencies at varying speeds and pitches.",i actually don't listen to genres.
Sorry. I just sincerely want musical recommendation from you. This is from 4.22.16  4:29 am?,that's a very complex and sensitive issue. i would be glad to discuss it privately.
would you want to get married someday?,i am hoping to find a bond more meaningful than that.
"I don't share anything with anyone because I think everything's egotisical, I just want to not harm anyone or make anyone feel bad because of my achievements. Should I not worry about this kind of thing?",you can worry about it if you want.
"History of Japan was such a well made video. Then I go to your website, and see how original and unique person you are, and I'm completely in love with your personality.What is your next project going to be?",a train.
hi my name is v sauce michael here and do you ever think about just fucking killing yourself?,"great question michael, and i think it's an important topic, especially among today's youth and young people. we're going to take a look into some of these issues in just a bit, but first, let's jump right into another puzzling issue we will be talking about today, Why Do We Have Thoughts?"
"Can you share two of your most recent songs of choice for the day, please? I am very interested in your influences from other musicians to gain a better understanding of where your music and persona comes from, because you are a fascinating individual.",nice try.
think you'll do more instrumentals? they're an instrumental part of your repertoire.,"over the years i've learned that instrumental music really doesn't serve its proper purpose unless it is used to enhance something non instrumental. even something as simple as dancing hampsters, or a nyan cat, can make an instrumental song suddenly meaningful to millions of people who otherwise would have no way to connect to it."
How many instruments do you play?,maybe 3 or 4.
"It took you 14 weeks to make the japan video, and it's been 11 weeks since. New video imminent in the next couple weeks?",that would make sense if i was doing exactly the same thing.
are you married?,no.
whats the difference between 2 based soul world and dorian and also 4 based soul world and lydian? RIP Prince?,"i guess technically there is no difference, but modal stuff i would consider more actually based in the key of the root. like dorian would be like 'so what' or 'can i get a'. and lydian (which is usually more of a momentary thing anyway) would be like the intro to a steven spielberg movie. this question will self destruct."
How rare are you memes?,"they are so rare they are not even considered memes until after they come out, and then the meme community might adjust accordingly."
Who runs the world?  (I think it's cats)?,"no it's not cats, it's actually people. specifically, people with the most trust points. to find out how many trust points you have, go to the bank."
what is the grass?,
"Hello im kalle and ive asked u a few questions before!! Thank u for answering them. I really admire u and your music & creations.I think i saw a couple times that u think about why walls are the way they are,and i wondered, what conclusion did u come to about walls?",
"If I put a mirror in space 1 light year away from earth, and then looked at that mirror through a telescope on earth, would I see the earth in the past?","only if you traveled faster than light to put it there. but if you could travel faster than light, you wouldn't need the mirror. just turn around and look back after you get out there."
Do you ever get tired of yourself?,
can you buy my mixtape?,no.
Is four a lot?,i'd say it is a medium amount.
"Hey babe, I really miss you. I still have the cats... and they really miss you. You should come back home.",i never lived in a home with cats.
how long did it take you to make the japan video?,
Any tips for MIDI interfaces?,"i thought those were rendered obsolete 10 years ago, and replaced with the USB cable."
Are you an absurdist?,"no,."
hellO yes i drank 9 glasses of water a day instead of 8 glasses am i going to die?,"no, you are going to pee."
does grass exist?,"i'm not saying. i don't want to ruin the surprise for you, in case it does."
hey its me ur girlfriend lets go?,where the hell have you been. and do you really think this page is the best place to talk.
Would you like to adopt me?Y/N?,who is this.
Aren't you pretty weird?,i think the proper term would be Reasonable.
if you could pick a single atom on this planet as your favorite which one would you pick?,
how many noses do you have and does it effect your eyesight?,"i have the normal amount. and yes, all the senses actually work together in a sort of intuitive fashion."
whats ur credit card info front and back?,my credit card is actually a leaf.
You should make vids about the Koreas! Or maybe China? Germany and Russia would be good too!,
i like you and want to help you buy breakfasthow much money do you usually spend on breakfast?,typically 1000 dollars per breakfast.
shrg;isnfidfgそdfんg添え вваваипкипі?,"oh, hell yea."
what is your blood type?,"red, i think."
What did Buzzfeed Japan have to say to you about History of Japan?,they loved it. they wanted to interview me.
"Can you make more documentaries about countries? Like Thailand, China etc. I really like your style. Super dope! Peace?",
tips on how to find out how it always was? i've been trying all my life.,"you will realize it gradually over time, as you see the same dynamics in the world remain the same, with different names."
I'm getting my wisdom teeth pulled tomorrow and I'm really scared. How to not be scared?,think about iraq.
What's ur social security number?,
How come you haven't posted any vines recently? Haven't seen you post anything on there in a while.,
Where’s the line between being the best version of yourself and being true to who you are?,true is best. that's kind of a rule.
Did you expect your History of Japan to become so popular?,i thought it might. but i was trying not to get my hopes up.
Hey whats your spirit animal?Mines a unicorn!!Cause one believes in me?,what the fuck is a spirit animal.
Come onnnnnnnn whats ur type?! Blonds or brunetts? ~Im a blond ;)~?,referring to people as a 'thing' based on their hair or skin color is offensive to me for some reason.
"Hi, I am sorry if this is annoying, but could you maybe write out what software you use for videos? I saw the image, but I don't know what programs those are. I'd really love to use them.","the programs i use are not that good, and some of them are obsolete. what i do has nothing to do with the software i use. just grab whatever you can get and start experimenting. That's how to do what i do."
Can the world run out of art?,no.
sometimes (most of the time) i feel insane and helpless and i never know how to deal with it. what do you do when you feel this way?,"i usually start documenting and recording my reactions and reflections on the situation, and continue expanding the catalog for the rest of my life."
hey there's this girl. what do i do ~?,be yourself. that's probably what she's doing.
what's your mbti?,
"What is the name of the song in the History of Japan video when you say, Knock knock, its the United States please I really want to learn it on the Snare.",i do all my own music. if i had to name that one i would call it The One Where Matthew Perry Makes Some Demands.
can you make the sequel to downstairs and name it upstairs?,i already made the sequel to downstairs and it's called 'history of japan'.
How or when did you start doing music? Talented btw.,started messing around with harmonies on the piano at age 2.
do u wear tight pants?,i try to wear reasonable sized pants.
Are you going to be doing anymore videos? i just watched history of japan and found it hilarious. do you plan on doing anymore?,i will never stop. but i might not always do the same thing i did last.
"Can I use a part of one of your songs in a YouTube video? (I'll give credit, of course)?",credit toward what?
What is the answer to 42?,2x3x7.
What if all of these questions are asked by the same person?,"then there would be less repeats, more consistancy in grammatical/spelling style, and at least some sleep gaps."
Are you still piece of garbage?,
are you celebrating 4/20?,not any more than i celebrate most days.
what kind of monster doesn't want pets?!,what kind of monster calls someone a monster for not wanting to keep someone else locked in their house for most of the day.
why is your icon an umbrella?,
Do you answer every question you are asked on here?,no.
"The song School was as long as it needed to be and is my favorite thing you have made, but I'm curious if you'll ever make an album filled with longer songs? Of course it will take more time, but your music style is wonderful and I'm sure people would love to hear more.",that may or may not be Exactly what i am doing next.
"unicorns, phoenixes or dragons?",what about them.
how much do u walk in a day?,8 hour walks used to be a hobby. but i don't have time to do that anymore. got 2 make the content.
"hi i like this girl, should I tell her?",it would probably make her feel great. but it might not make her like you.
what's ur favourite flavour of smoothie?,never had a smoothie.
Do you think that you will write any songs with the call and response style of composition?,i'm sure i already have. although that could mean different things.
what patches do you use on your Yamaha MM6?,only the 74 rhodes.
"I am interested in things that challenge and defy the expected, and am willing to support original content that goes beyond the ordinary. Does this remove the purpose of my last question? (The one where I talk about requests and Patreon)?",i'm not sure.
Why do you want to make longer videos?,i want to make videos of all sizes.
can you make a video about beagles?,no.
will u marry me?,who is this.
hitler's birfdae is tommorow. you gona celebrat it?,i actually don't know him that well.
at times do you ever feel like you've run out of ideas?,only when i'm on a tightly regulated content schedule like in 2014 or 2015.
What's important?,understanding.
How about putting a giant red 'FREQUENTLY ASKED QUESTIONS' at the top of this questions page? Or something along those lines?,seems legit. but then i would have no good way of responding when people inevitably continue to ask those same questions. that would make me feel more insane and helpless than i already do.
Do you love me? I love you. Want to get some ice cream?,who is this.
You've for sure already heard it but I must say that the history of japan video is absolutely magnificent and it would be very fun if you kept on making content! Will you?,"of course!  i have been doing it constantly since feb 2, 2014 and will never stop. currently experimenting with some longer and different formats. it was time for a change from the 6 second vine train. longer/different stuff takes much longer to make, and people usually assume i am doing nothing during the time i am working on it. but if i didn't take that risk, you never would have seen a video like 'history of japan.'."
Can I ask you a question no one has ever asked you before?,i wish.
does it ever bother you that being blunt and to the point mean the same thing?,no.
can onions have opinions?,"not usually, but when they do they express them."
do getting so many qustions about the history of japan angry you?,hahahahahahahahahahahahahahahahahahahahahahahahahahahahahahahahahahahahahahahahahahahahahahahahahahahahahahahahahahahahahahahahahahahahahahahaha no.
how old is you dawg?,
"Let me reword my previous question Katy Lied or Countdown to Ecstasy?, Which Steely Dan album do you like better, Katy Lied, or Countdown to Ecstasy?","how do you like an album if every song on it is different, and every moment of every song is different, and every day you feel different, added to the fact that you have no idea which song is on which album anyway because you grew up in the digital age."
Frank Zappa?,"no, this is bill. try checking."
