question,answer
",wuretieiiefouwirerteiiwtwuterrqwritwiyruieuwwqwewqwtwyowriiqeiwetwwwriwaweaeariqtowwyuariweewriayiwuiwteayeqyuqyeauwasiqyeyoqwwwiueyiqietuquwywqeeswawuweiuwwatetreeqtewuequiuwqraweuiqrrertwwaiqtesuetoqritewowetwqrewtewieasywtrwwwuruueuiui?",
hi bill whats your favorite cloud?,i like the unique qualities of each one.
what key is most of your songs in?,most of my songs are in different keys.
"some people are claiming that youve made jokes about rape in the latest video, with stuff like the race for africa thing; what are your thoughts?","that's not really a joke, they pretty much really did that, and it's really called the scramble for africa."
are you overwhelmed by the overwhelming response to hotewig? or were you ready for this?,"the response to history of japan was similar last year, so this year i have decided to hide under a rock. it's nice."
have you ever written a capital letter?,yes.
"although i know you understand the seriousness, why use rape in such a joking context/manner and with the knowledge that theres absolutely so many youtube edgy folk that went HAH RAPED along the unfortunately popular current usage of 'rape' as in defeating somebody or doing better than them. this tone isnt meant to be accusatory i just would like to know where you stand on this, i love your humor and the effort you put into your vids but i personally couldnt watch this last one after the first mention?","in the case of the scramble for africa, i was trying to explain it in the quickest and most efficient manner possible, and if you read up on the scramble for africa, i think you might find that that is a reasonably accurate one-word description of what happened. in the case of the rape of nanking, that is what the event is commonly known as, the 'rape of nanking.' i should also mention that i was heavily criticised last year because the rape of nanking was not mentioned the history of japan video. so i decided i should mention it in this video. i hope that makes sense. also i can't control what happens in youtube comments, unless i disable comments."
do you think you'll ever do a tour or some vid on type thing because I want to give you a high five?,
What made you want to start making videos?,
"whats your favorite kind of sword,?","i'm not familiar with swords, and i don't normally use them."
what is a computer?,"it's kind of like a prototype person, built by a person."
did you know you were posting history of the world right before the ap world history test? (I watched it on the way to test and took it as a sign from the gods)?,"people started to tell me about those tests in april, assuming that it would be done by then, and i assumed it would be too. then as it got closer, i almost started to get stressed in a weird way, and then i got sort of upset about being stressed because test-prep is so not the reason i do what i do. if i did that, i would just get on camera and say a bunch of facts, not spend almost a year making the craziest thing i possibly can. so as the video was approaching completion on the week of the test, i was a bit torn because i didn't want to feel like i was racing to finish it for the test. and yet i didn't want to release it the day after the test either. it was very confusing and strange. the test was a very strange thing to think about, and it was very important to remember that that is not the reason i did it."
"how much history did you have to learn to make a history of the entire world, i guess?",probably about 5 times as much as is in the video.
why do you use this font?,i don't use any font. the font you are seeing here is the font your browser chooses to use when there is no font assigned.
how do you do stuff with things?,i try to just get some things and do the stuff. if that doesn't work try doing it sideways.
Why don't you have ads on your videos? I mean for the longer ones. You deserve the extra revenue for all your hard work on your HOTWIG video?,"revenue is good, but renting my audience to advertisers is a sacrifice i am not interested in making. it kind of defeats the whole point of what i'm doing."
How come you don't have ads on the vid? U couldmake so much money?,"the money would be lucrative, but renting my audience to advertisers is a sacrifice i am not interested in making. it kind of defeats the whole point of what i'm doing."
do you ever see a question that you really want to skip but you don't and answer it anyway?,oh hell yeah.
would it have been better to be a dog or a rock?,no.
what happened to canada on the video or whatever?,it's kind of like when you try to juggle 500 balls but you can't juggle them all. that's what happened to it.
why did u originally decide on a history of japan video so specifically and not any other country?,
will you be using your graphics tablet more in future videos?,oh hell yeah.
"your new songs will be like two different meat cooking styles: medium, and well done?",they will be more styles than that.
"if u read this that means u can read, you are able to understand, and you have eye(s) which are able to identify pixels on ur monitor, oki?",i see what you mean.
why r ur videos well made but ur website straight outta 2003?,i have tried to make it in a way that i think is good. i'm not sure if that answers your question.
Why don't you capitalize proper nouns?,it seems to me there is no exactly fair way to determine the propriety of nouns.
you misspelled uruguaywait that's not a question?,"sorry about that, i actually thought it was uraguay."
are problems you have today rooted in your childhood?,sure. although i think i found a way to make the best of most of them.
We have identical humor and I find you attractive. How can we get to know each other more? ;)?,"option 1 is i post this and tell you to email me. then you and many other people email me. and if i don't have time to respond to all of them, they will post angry comments on here. option 2 is to not post this and i never hear from you."
"do you prefer to be called a musician, a youtuber, or both?","musician. i prefer not to label people based on what sites they may have used. you could call me other things too, but musician is accurate for sure."
how do i get a job in advertising after applying over 700+ times?,"i think you will have much better success if you apply to 700 jobs, instead of applying 700 times to 1 job."
are you working on a song now?,oh hell yeah.
why does 'car' show up often in your songs? like 9 different times?,"i think you will find that it has been showing up a lot in popular music in general for at least the past 50 years. it is just a fun easy word to say, and a fun mode of transportation. too bad the fuel makes such a mess."
"at 5.11.17  5:12 am, does that mean that you wont make 19 second videos or 8.2834729304 second videos ever again?","i need to catch up on medium lengths projects first, until i no longer feel like they have been hopelessly neglected."
"hi bill, i really respect your work. keep on keepin' on. question: do you think public transportation has a big impact on society outside of trains and airlines? love you. ser?na?","yes, particularly busses."
how do I unbake a cake?,"that's a great question, i'm not sure."
you didn't even mention Nepal :(?,i'm sorry.
"Did you expect people to tell you all the stuff you forgot about,?",oh hell yeah.
how do i know what i like?,i guess you'll just have to guess.
"I noticed someone mentioning that the wave particle duality concluded that nothing would exist without life. This is absolutely untrue, an observer as defined by physics is very, very different to what the traditional sense of the word means?","the way i would think of it is, everything exists. but life is the only one who ever notices."
Hello you misspelled Uruguay on the map of Latin America in the video?,"sorry about that, i actually thought it was uraguay."
what did you do for the last 11 months?,i was making a video.
Will you make more history of x videos pls?,i would like to perhaps do something a little bit different.
whos ur main in super smash bros?,link.
how would you be everything if you are nothing and everything is nothing but nothing is everything?,how about being something.
im lonely?,me too.
I don't have a question I'm sorry?,that's ok.
on a scale from -1 to 42 how much do you like hamburger helper?,i have never tried it.
have you ever had to pull an all-nighter f0r a video?,"does it count if you wake up at the beginning of the night, work all night, and then go to sleep in the morning."
CONGRATS ITS [HOTWIG] OUT now what?,i can't tell you.
Uh hi you forgot brexit in that video on the history of the world but other than that you did well kthxbye?,"i did not forget brexit, i decided it would be irresponsible to mention brexit because what if the entire EU collapses next year. then it will look pretty silly to only mention brexit, when brexit is really a small piece of a larger story."
are you obama?,no.
Why did you make this?,so i can answer peoples' questions.
"Bill! Congratulations on releasing your new video! Its a good one. My question is, where will you go from here? I mean, the history of the world is an ambitious topic, and you pretty much nailed it. So how can you one-up that? *<*?",i can't tell you.
how are there 3 americas but only one part of one america is the real america?,"united states has aquired the nickname america which i think is unfair, because america actually means that huge entire continent in the western hemisphere, actually it's 2 continents."
What is your favorite word processer?,"that simple one that probably comes with your computer. not the weird one, the simple one."
"Oh shit, do we get more songs i like songs songs are good yes please?",oh hell yeah.
This is a question?,are you sure.
you forgot about the troubles in ireland?,"no i didn't. but it is not in the video i just made, unfortnuately. not everything in the universe fits into 20 minutes. i'm so sorry."
will you do an ama on /r/videos please we love you?,"i have answered over 15,000 questions on this site, and will answer many more, in the future. that will have to be good enough."
do you feel relived finishing history of the entire world?,oh hell yeah.
"great video, I think you went a bit overboard with the detail though?",some people think i didn't include enough.
"the video was brilliant, like, really good. i especially enjoyed the swahili gold line, haha. looking very forward to the upcoming songs and journals! thanks for the great content - amani?","oh wow, i remember you emailed me from africa the day i wrote that line. that must have been way back in july or august."
are you ever gonna work on a ten minute long video ever again?,i'm not sure.
hey can you do more really long videos please or give me a way to listen to you talk about more things at length?,i will see what i can do.
Are you happy with the final version of HOTEWIG?,it will have to be good enough.
now that you're done with the history video can I have my short songs please?,which ones are yours.
HOLY FUCC YOU DROPPED THE VIDEO WOAHHHHHHHHHHHHH?,
T H E  V I D E O  I S  N O T  O N  Y O U R  W E B S I TE?,"it is now. it took a little while to upload, it's pretty long."
HOLY SHIT?,
What was the date when you first started on history of the entire world I guess?,"june 16, 2016."
DUDE I FUCKIJG LOVE YOU!!!! THANJS SO MUCH HOYL SHIT?,
IIIMMMM SOOOO HAAAPPPPPYYYYUU?,
AHHHHHHHHHHHHHHHHHHHHHHHHHHHHHHHHHHHHHHHHHHHHH?,
BILL OMG YOU DID IT I LOVE IT CONGRATS?,tahnks.
was the i guess always planned for the title or was it added at some point in your creation process?,"i think i had the title finalized when i started writing. i think i questioned it a few times, but i kept coming back to it."
Bill I just got the notification for your new video I think I shit myself what do I do now?,continue living your life in a way that you feel is appropriate.
:0000000?,
What term would you describe your music with? I like big city?,"i am more interested in making the music, instead of describing it. that way, you can hear exactly what it sounds like."
Why you no answer my questions?,
how will you deal with the hate when people find out you will be doing songs in the future and not even crazier history videos?,"the same way i deal with all the other hate i always get for going in any direction, instead of a different direction."
"why don't you turn on youtube ads, you can probably use that money to hire someone to accelerate the making of content, even if you don't want that money?",
"i corrected some mistakes in the questions graph and added in the data from ask.fm, i think the trend is much clearer now: http://imgur.com/z4YpC3dsome of the dates are questionable due to time zone discrepancies, but then again the graph only tells the dates the questions were asked, not answered. in 2015 you answered on average about 2.5 questions per day, in 2016 the average was about 30 questions answered per day, and so far the 2017 average is nearly 49 questions answered per day (as of 4.30.17). as of today i think it's fair to say you've answered over 17,000 questions.raw data is here: https://pastebin.com/D82PfQuG?","ah, nice job. if you email me the image maybe i can post it here."
"Hi Bill. I have a confession, i'm gay?",ok.
a lot of your videos short videos have it?,"no they don't, all that music was custom composed to fit the video."
"Why don't you put ads on your videos? I mean, money bro?",
"I am so focused on gathering knowledge that I find it difficult to form opinions based on the knowledge I gather. I am always afraid that I will have missed some monumental information that would utterly destroy my worldview. Am I simply to be a vast database whose purpose is to dispense knowledge for others to make into opinions and consequent actions? (I'd be totally cool with that, but I'm running it by you first.)?","i don't think you need to try to have opinions. opinions are fine, but they are not something you want to necessarily aim for. this world is a very intricate mix of different elements, all flying in different directions. it's nice to take it all in together."
i really like rewatching videos i make. why might this be?,because you made them how you like them.
i've sent you many questions but you seem not to ever actually respond to them so i wonder how you choose which questions to respond to and which ones to ignore because there must be some questions that you just overall really don't want to answer and this is probably one of them sorry its so long bye?,
are you at the home stretch?,i think i'm in a weird strange void beyond the home stretch.
popsicles or vegetables?,
"Something that happens to me all the time on this site is that I ask you a question, check back two or three days later to see the answer, and I can't find it because I forgot what I asked. :(?",
lol wouldnt it be funny to make the video and then just not post it?,"i've never thought of that before, but i'm starting to think that would be funny."
Are humans boats?,i'm not sure.
"are you obsessed with time? do you think time is also obsessed with you? (i think it is, and it seems to love you very much. because usually time doesn't give people so much quality time, and gives them quite a lot of bullshit time. it seems to give you mostly quality / efficiency tho. so you get more time for your time.) i think you and time love eachother :)?",time and also space are very important to how everything in this world works. i think thinking in terms of time and space is extremely useful in a wide range of situations.
what's your opinion on the people who have given up on waiting for the new video and they lost interest in it?,that seems like it's none of my business.
"you are okay with profanity,?",i don't have a good system for determining whether a word is 'profanity'.
You've increasingly have been saying I can't tell you. What can you tell us in regarding to the status of HotEWIG? -Jaz?,i'm not talking about it anymore.
"do you ever feel like you don't know what the fuck you're doing, or what the fuck is going on?","sometimes, but not too often anymore."
is figuring out how to cut corners on the video (or any project) while also making sure you're satisfied with it a challenge?,yes.
what type of people do you like?,each person is a unique blend of types.
is it possible to get a sweet record deal from yourself?,sure.
how the hell does one become as patient as you?,find out about the sweet rewards.
MUSIC IS SO GREAT?,"ah, i know what you mean."
When will there be a new YT upload?,
do you think trigonometric functions have anything to do with trigonometry or functions?,"i always assumed they did, but now i'll have to think about it."
will there be more history lessons about countries other than japan? (by yourself)?,perhaps i could think of something a little more interesting than a country.
opinion on nouns?,it's things! and stuff.
"did you ever wish to be normal? if so, how did you rid yourself of this perverse desire?","i originally thought i was normal, until i realized that everyone else was different."
at what point in the song writing process do you usually decide on a  name?,"whenever it becomes obvious. or it does not become obvious by the end, then i will have to figure something out."
how do I become attractive to my target demographic?,"i think it works better if you choose your target demographic based on who already would find you attractive, the way you really are."
"huiahuihewlklkfgkldfngjnreknkgjer?thanks,heuwi?",i will see what i can do.
what is the answer to the multiple choice question in i'm crazy / it's raining?,i don't remember what the question was.
why haven't you uploaded anything in a while?,
should i worry?,you can if you want.
what party are you associated with?,none.
what do i put in this box?,"a question, or perhaps something else."
Is art dead?,no.
what's your favorite subject?,how to figure out what the hell is going on.
Can I blink?,you will have to try and see.
Am I cool?,
This is a statement?,
Do you like any of the things?,oh hell yeah.
Do you like rulers?,they are ok.
Do you like turquoise?,it's ok.
How do you deal with stress?,
When did you start making music?,
What is the point of existence?,
Why do you exist?,
How did you become a positive person in spite of a not positive world?,the world is a mix of positive and negative. people seem to mostly be the same way.
why do you not make any more history videos?,i have been making one for the past 10 months.
i only passed the japan portion of my test?,
In hotewig will you be speaking at the same speed as in hoj?,approximately.
"Since you pressed caps lock in that one answer,?",i have used caps lock in many answers before.
Make a song?,i will make them all after i finish this video.
do you ever think about how cool the world is and feel nice like wow earth is a rad place humans r so cool?,yes.
also how excited r u for the new songs?,"very, extremely."
;ly u spel questio n rong?,
pictures of richard nixon sweating?,i don't think i have any but that sounds cool.
how do I check whether I'm alive? I know my body is alive but what about me?,asking if you're alive is one of the strongest signs of being alive.
are you one of those people who never finish anyth?,no.
can you tell us if the video will be out before this Thursday AKA The AP Global Exam?,
do you like green piags?,they are ok.
Release the video so I actually have something good going for me during finals week?,
What is your favourite shade of green?,whichever one seems to work best for the situation it is used in.
Srsly what video takes 10 months to make?,"the one i am making now, perhaps some others i guess."
do you think pressure from society inherently Bad?,"i think there is pressure all over this universe, which is what makes it what it is."
do you think physics is interesting? i think it's very cool and good and i love it?,yes i agree it's pretty cool.
"Please drop a hint while answering this question, even though it isn't a question?",that reminds me of when the dutch stole the spice trade.
this statement is false?,"ah, i see what you mean."
what's the password for the text field on your reality page?,
Can you explain the Persians? Like Persia and stuff?,i will try.
can you please catalog this page so I can go see when questions were asked?,"the date/time each question was asked is shown in yellow, next to the question."
do you ever think of something funny so you ask yourself on this website and then answer it because its funny? I hope that makes sense?,
how many genders are there?,
"What made you start making videos on Youtube? I know some videos weren't originally made for Youtube, but I'm just curious about how you got their and what motivated you :)?",
am i dead?,
"also, do you listen to your pre-recorded voicelogs on like 3x speed? that's how i skim huge things of audio. you would think you lose the ability to hear sentences, but you don't?","i go 3x through the long gaps, but when there's talking i go to 1 or 2x. faster than 2x starts to get hard to understand."
what do you consider weird?,being normal.
the video will come out nowhere near summer-bill wurtz?,"ah, i see your point. i will cancel the video. the video is cancelled."
happy birthday?,
http://www.in-groundtrampolines.com/wp-content/themes/in_ground_trampolines/images/body_bg.jpgground or sky?,that looks like about 2/3 sky and 1/3 ground.
"dude. how do you work s o hard, all the time, and not go crazy?",i was already crazy before. i'm working to make people understand.
"zimbabwe or uganda? (which one do you prefer, dont try to be smart like the time i asked you tits or ass)?",i like the unique qualities of each one.
"please live forever, if you can. thank you?",i'll see what i can do.
what are the odds of you saving the universe from it's eventual heat death?,i will try to help if i can.
bill my earbuds stopped working completely in one ear. how should I solve this problem?,get new ones.
Would you like to answer this question?,sure.
do you ever end questions with a period. i think this is a nice style?,"yes, i agree. i think it's sometimes interesting to do that."
have you ever thought that our motivations are deeply rooted in wanted to impress people?,"i think there is a deeper layer than that, which is to survive. impressing people does actually help you survive."
"I think I understand why some people think you are waiting around to upload the video as if it isn't done. it is because on your instagram picture with the plan for HOTEWIG, you say the last thing you will do before uploading is drop crazy hints. by a sort of literal interpretation of thay, it must seem to some that you are done now and dropping crazy hints before uploading?",i think the dates shown for on the history of japan progress report do overlap in some cases.
"Isn't it convenient that some letters rhyme even though they are different letters? (B, C, D, E, GP, T, V, Z)?",it is convenient in some situations.
when did u get ur period?,so far i have never gotten it. i hope that's normal.
Are you ok with me writing nice stuff on here?,oh hell yeah.
have an estimate on your next video's release?  I won't take no for an answer?,
what is your favorite pokemon?,
please come to brazil?,
does your new video take the lord's name in vain?,it depends how you interpret it. also i don't really know what it means to take a name in vain. another thing i should point out is there are multiple lords mentioned.
how do i stop feeling sad about losing my atudent council election?,"look forward to your next election, in which you will have even more experience with elections than you did before."
did u ever make a reality video for when u were making HOTEWIG because i would really like to see the artistic process that u put into it?,"i have been recording journals every day just as i have for the last 7 years. making those journals into videos, as usual, will get kicked down the road until whenever it's a good time to put my entire career on hold."
Would you ever do a interview so your audience can really know who you are or are you just too shy? i'm curious?,"i have answered probably over 20,000 questions here. if you read this entire site, you will probably know me extremely well although you won't know what i eat for lunch i am sorry about that."
have you considered making another deadline to give yourself a final boost similar to the one in december? or would that trick no longer work?,right now i don't really need a boost because i am so close to finishing the project. the important thing now is that i make sure everything's ok.
"Whoa bill, is the stress of the project getting to you? I've never seen you use all caps before?","it has always been a valuable tool, in my repertoire."
why does everybody and their uncle's iguana want you to do collaborations?,i don't know.
can you explain gravity?,gravity is usually what explains other things.
"I think people get annoyed because you say very small things, so they assume it will take 5 minutes?","i've been working on this thing for 10 and a half months, i kind of want to make sure it's all set."
maybe you should just keep the video for yourself and not release it since people are so annoying?,you know i never thought about doing that but i am starting to consider it.
What do you recommend I study for my APWH test (May 11th)?,"i have no idea, i don't know what's on the test."
PS ILL PAY YOU LIKE 20$ TO GET THE VID UP BY MAY 11th like you don't have to no pressure but just a lik incentive ;)?,"i will finish it as fast as possible, regardless of how much money you give me."
