question,answer
explain the concept of time to me?,"it's scenarios playing out. it's like when nothing ever happens and everything is permanently the same forever, and you're just like damn i could sure use some SCENARIOS so you think of some scenarios. 'time' means how far you are through the scenario."
"Yet, in these questions you make it clear that none of that is true. You're not sad and depressed and are actually very driven and productive. is the self deprecating personna just for show? is it because the internet likes that kind of humour so you make it like that? Im really perplexed by the whole thing?",
"do you like dank memes? if so, what is your favourite maymay?",
what is your least favorite word?,
are you very self critical of your own work?,yes.
"and has it ever stopped you from writing songs,?",not writing. recording yes.
Whats next? Love your videos btw?,
do you think chips will still sponsor you after coming out as anti-ad?,i have never been sponsored by anyone.
What part of hotewig did you use the emotional Zawinul for?,"i used it a lot. it is a mid-range lead sound. it is used on  'grab stuff at the same time' probably that high blip on 'dinosaurs,' 'better farming was just invented,' 'oh look it must be the (mycenaean) greeks,' 'ah the greeks just had the idea...' 'hey china put itself back together again,' tibet (in a lower range, it blends in with the chord), 'korea just became itself,' 'china's back yay' (it's all by itself on that one), the renaissance art montage, australia, and surely many more times."
could you harmonize a political speech?,"sure. i actually started doing a barack obama one a long time ago but i never finished it. i doubt anyone is too interested in the 2012 state of the union speech any more, so i might have to pick a new one."
what do i do on a date?,try to make sense of the world around you.
"You seem like you're really good at being yourself, so i would like some advise. i always feel like a chameleon acting like the people i'm around it's like i have a completely different personality when i'm with different people. So if i'm trying to be myself should i be a chameleon because that is myself or should i try to be me. if the second how do i do that. (p.s. i like your reason for always using lowercase i's)?",i think over time you will become a unique blend of everything you've ever liked about anyone.
Are you going to make anymore reality videos I think they are cool?,
how often do u AAAAAAAAAAAAAAAAAAAAAAAAAAAAAAAAAAAAAAAAAAAAAAAAAAAAAAAAAAAAAAAAAAAAAAAAAAAAAAAAAAAAAAAAAAAAAAAAAA?,i'm doing it right now.
I'm sorry I can't understand is your next project medium size?,it is a never ending series of medium sized projects.
I always ask questions on here but then I forget to check back until a week later and I have no idea what the question was and can't find it help?,
what to do if i dont know what the fuck i want to do with my life?,try some different things.
Why is there a world?,there is everything.
Can you tell me everything that's happened in the world?,not right now.
what is your favorite key to write in?,which ever key the idea was originally in. although it really doesn't matter.
Could you name us some of your favorite opinions? Because it seems like any time anyone asks for your opinions you deflect the question. -J?,"my favorite opinion is that the truth can be a nebulous myriad of shapes and sides, and it is nice to enjoy the ride, rather than keep it on pause permanently."
"In response to the question about you being identified as a YouTuber, I'm not so sure that it's a phase. YouTube is one of the biggest platforms out there,?",unless you think outside the box a little.
"so unless something emerges that is even bigger than YouTube,?",some of the biggest ones have been around since before youtube.
who makes your music?,
Knock knock?,come in.
"i have an idea! make a jingle video saying this video contains ads or something and allow ads to be displayed on it. just this one video. this way people who dislike seeing ads will not have to encounter them and people who keep demanding ads can support you this way. actually you know what, don't even put a jingle in there, that would be unfair for those who wouldn't watch it. just make it a few seconds of black screen, maybe with a text saying thanks for your support at the end. what do you think? (please, don't hyperlink it with the other ad-demanding ueqstions, it doesn't belong there)?","i've thought of that. but i think people get in trouble for that. also every time i think i have an idea for some clever way to monetize something, i them suddenly snap out of it and say 'no!! why do i have to do that? i am here to make the content i want to make, and post it to be viewed the way i made it!! is that so much to ask?' it's kind of like when a knife salesman insists on coming into your house, so as a compromise, he is able to convince you to let him sleep in the dog house, and not bother you. but then suddenly you snap out of it and say what!? no, how about just leave entirely."
Can you save me?,i will try.
do you like capital letters?,yes.
"hey bill this question im about to ask is very important to me because i struggle with lack of productivity? how do you stay so productive? i was convinced that you were procrastinating on HOTEWIG but you were actually making it as fast as you can all year, while also probably working a normal job (idk ur financial situation). also, some videos of yours indicate that you can be lazy (i dont wanna clean my room),?","that song was fictional. but even if it's true, if you think about it, it's a sign of my productivity. because at that time i was spending all my time working on history of japan, to have it done as soon as possible."
I've always wanted to get good at piano improv but I've been intimidated by the thought of learning a buttload of scales. is there a way to learn to improvise well without having to get comfortable with how scales work first? I've never been good at learning scales because the technical side of music is a mystery to me. is there a way to learn scales through osmosis?,scales? forget that. just learn what notes you want. and don't blame me if they sound good together.
"hey, for clean my room, it's something like 11 beats in the whole phrase no? can i ask you how you split that up (if you chose to think of it that way) in terms of groupings of beats? my friend and i were thinking it was (1)(4)(4)(2) or maybe (4)(3)(4). gnarly meter my guy?","with clean being the top, i think i would hear it just 4, 4, 3. although 4, 3, 4 is reasonable too if want sky to be at the top of the bar."
like the only reason the vids are there are for profit?,exactly.
and i appreciate u not putting ads on vids bc it makes it seem u just wanna make good content and stuff. i hope u are making money somehow tho cool?,yes i am.
if life had an undo button and i kept pressing it would i eventually not exist or would it limit the number of times i could press it?,"you made up this situation, so you get to specify the rules."
"this is not a question, i am a rebel?",
this is not a question lmao you got prangkt?,
"i had a dream that i woke up and you had uploaded like, 10+ new songs to youtube at once. it was really unrealistic because i know you'd never hold off on uploading them like that, but it sure was exciting?",it is more realistic than you might expect.
can you make the umbrella thing your website icon so it stands out?,
is pluto a planet?,you have to decide for yourself.
True or False? Y/N?,maybe somewhere in between.
can you not reply to this sarcastically?,sure.
appreciation day of appreciation! happy day and appreciation?,.
do you wanna come over to my place this Friday and talk about feelings?,oh hell yeah.
any advice on how to get a sharper piano recording on an iphone? the audio keeps sounding fuzzy and it's hard to distinguish the ingredients of the chords. thx?,try putting the phone in different places. i don't know where you have been putting it but definitely don't put it on the piano if it's an acoustic piano. put it somewhere else in the room.
are these questions actually from other people?,yes.
"If there's a room with the ceiling, floor and walls all just mirrors, what does it look like inside?","it looks like a lot of whatever you put in it, especially what light you put in it."
Will you go out with me?,sure.
Have you got any tips on making music?,don't forget to do it how you want.
What is this?,the questions page.
"Does anything external ever influence your work, or do you try to just let it come from the inside? I hope that makes sense. - Melody?",.
Are you still here?,where.
Do you have to constantly remind yourself to not type with capital letters?,no.
Why did you choose to do your first history video on japan?,
can we be friends?,sure.
"if you had all the time in the world to create and work on everything you wanted to, how long would it take you to get through all that work?","maybe about 1000 years BUT during that thousand years i would have had ideas for 20,000 more years worth of work."
has the illuminati approached you to become a member of the illuminati now that you have one million subscribers on youtube?,"i just found out that they don't do that, you have to fill out the form yourself. i filled it out today."
"When you were first learning music, how often did you practice? Did you mostly learn by ear,?",yes.
What is with your lack of capital letters?,"i use them when i think they are necessary, for communication and expression, etc. I'm not sure if that answers your question."
"as a kid taking standardized tests I always ignored the do not spend too much time on one question advice and always tried to tackle the current problem at hand before moving on, however long it took. is this similar to your experiences in terms of your projects?",no.
Why is it the way it is?,because you said so.
what's your biggest regret?,
"I really enjoy your style, it inspired me to take up editing and such. I want to develop my own style, but I wanna ask how did you develop your style? - zwonna?",
"i hope you don't feel too much pressure to post lots of videos and such quickly. take your time, man. don't rush on our account?","i already do rush. i am at max speed. the reason i don't 'make content more frequently' is not because i don't want to, it's because it is impossible to make it any faster."
what do you do outside of youtube?,"everything. (except uploading videos to youtube, i have to go on youtube to do that)."
Why does videos such as the history of the entire world take so long to be published?,"because it is a large file. it takes a while to upload it to the internet, maybe 45 minutes or so. if you think that's a long time, wait til you find out how long it takes to make the damn thing."
why do you commonly write in all lowercase?,
Where is your drum set? -Meeee?,"stacked against the wall, in the cases."
why does being alive feel so weird?,because it is.
what are you most proud of?,being born.
how do you make sweet retro graphics?,"just try to do graphics in whatever way you think is reasonable, and wait for everyone to start calling it retro, and wonder why the fuck they are calling it that. and then quit the whole thing and become a postman."
Why don't you put ads on your videos you FREAKING DESERVE IT?,"because it is a waste of the viewers' time, and is a drag on the viewing experience."
"What made you want to make your first history video about Japan? As a Japanese person growing up in America, it was very helpful and I also really appreciated you spreading knowledge about Japan. - Aya?",
what if the flat earth theory is correct?,i'm not sure i know what the theory is.
do i even exist?,i think so.
Do u like water?,oh hell yeah.
"on the improv entry from 3.3.09 12:06, you make a face of utter disgust at the sound of car horn outside,?","that is not utter disgust. i was completely shocked that the car horn honked the note i had just played. like i played a chord and a big note, and sort of lingered on that note, and then the horn honked the note. that was the only reason why i posted that clip. it was kind of a miracle."
"have you found a way not to get disturbed in your own home while making music ? do you enjoy the challenge of the possibility of getting disturbed, do you seek to be disturbed to test your limits, do YOU disturb the neighborhood whith your music, have you ever had complaints about the noise comming from your appartment, how's the sonic isolation on your building ? have a good day?",
Will you ever collabrate with anyone? (Matt) (im saying matt so later i can look this question up and see if you answered it?,
I wish you mentioned Brazil more in your vid :(?,.
how does one avoid failure?,don't do anything.
will you fix the typo at the top of this page?,what typo.
Why is there no B# or Cb?,"there is. B# means C, and Cb means B. you might use B# if you are coming up a scale like F#, G#, A#, C, C#. but you can see if we use B# instead, it looks like F#, G#, A#, B#, C# it looks a little neater because we have 1 of each letter, instead of having no B and 2 C's and have to un-sharp and re-sharp the C. same thing the other way, if you are in Gb major, you might prefer to say Gb, Ab, Bb, Cb, Db neatly so you use all the letters in a row, instead of having to un-flat and re-flat the B by going Gb, Ab, Bb, Bnatural, Db. if you are writing on the staff, the advantage of keeping it scalar become even more clear. i hope that makes sense."
Where did you go?,when.
why u so weird?,i'm just trying to be reasonable.
"surely one cant only be a creator without also being a consumer. people always say that you have to read to be able to write, watch movies to be able to direct etc. id love to hear your input on this thanks. Keep up the good work?","i have consumed enough content to almost explode with inspiration, ideas, jealousy, and desire to make my own content. also to put it in perspective, i am making content as fast as i can and people still tell me every day that i do not make it fast enough, and people also at the same time (like you) tell me every day that i should watch tv and play video games etc."
could you define your contents/songs so that my 5yo kid could understand it? (basically ELI5)?,in songwriting you can do whatever you want. so i'm trying to see what i can do.
why not try to be unreasonable it's more enjoyable?,"ah, i think that's reasonable."
how many memes do search a day?,i mostly make my own.
how are you related to Bill Nye or Bill Clinton?,they are my parents.
do you support a sports team?,every time i try to support a sports team all the players switch teams and then i feel like i'm just supporting the colored shirts.
does post-hotewig life feel like summer break?,it feels like the god damn promise land.
i should just lay down and die?,that seems counter productive.
sometimes i just want to quit living?,.
why do you have so much faith in humanity?,"they are what brought us reading, writing, music, inventions, and much more. they are always cooking up new tricks."
what is the point of being verified on twitter or youtube?,"that is to let the public know that you are somehow famous or more important than the average user, and are generally unapproachable and perhaps a member of the illuminati."
I love making funky chords on the piano and such but I also wanna know what people are talking about when they add a seventh?,"if you have a c major chord (c, e, g) adding a major 7th note means adding B, and adding a flat seventh means adding Bb. it's like if you go up a C scale (c,d,e,f,g etc) and count 1,2,3,4,5 etc, it's the 7th note. which is either B or Bb depending on what mood you're in."
or sustain a chord?,"sustaining a chord just means holding it down. like if you play a chord and don't let go. pianos also have a pedal for this, so you can play the chord and let go but if you are holding the 'sustain pedal' the chord will stay on until you lift the pedal. very handy."
and actually be able to play it or be able to work with it. I've been studying sheet music for less than a year now but I still wanna understand things. Thanks for any help :)?,"just keep doing what inspires you and be a magnet. every time you hear someone mention a thing, ask around to find out what it is. chances are it will be something you are already familiar with, but maybe called it something different."
why is your content so damn funny?,i'm just trying to be reasonable.
why aren't you verified on youtube yet?,i don't know.
When did you get verified on Twitter?,"i think around december. it happened without warning, i found out from the fans."
legos or megabloks?,
did you expect your video to get as popular as it did?,i knew it was plausible but you can never be sure of these things.
how does this work?,people write something and then i have to figure out something to write in response.
how many Mega Huge Realizations have you had in your life?,at least 12 or 13.
do you believe in aliens?,
how is i can't tell you going?,awesome.
why you always play imaginary drums?,"because playing real drums is extremely loud, which i can't do where i live."
How do you manage to keep up with all of these questions? -From Mark Petk?,skip a lot.
i've noticed a good number of videos?,2.
Do you still answer questions btw i would be so happy if you answered -From Mark Petk?,yes.
Should i worry about if she likes me back or not?,you have to just be who you wanna be! and let her worry about whether she likes you.
is the history of entire world I guess is the answer for all the people who keep asking for more history video? Is this mean there will be no longer history videos in future? :( plz answer?,"the japan one was like a test run, or warm up, before attempting the world one. i'm not sure if that answers your question."
i have this question that I've been preparing for a long time but I don't think I'm ready to take the next step?,ok.
what should i draw?,
Is cereal a soup?,
if you ever had a new name what would it be?,
how do you feel about entropy?,i'm not sure but i've heard it's bad.
why do people keep asking dumb questions about  capital letters when you very clearly use capital letters on a fairly regular basis?,"because they are thoughtful, and inquisitive."
Why did you misspell thank you?,
Are you going to go back to your goofy songs or stick to the long ass short films like your last one?,how about something in between.
Is it D# or e flat? just curious?,is what D# or Eb.
how many things have you learned?,maybe 100.
why don't you answer questions which ask why?,why what.
how do I deal with fake friends?,leave them alone.
Have a great day :D?,
do you have a problem with punctuation?,no.
do you ever get one of your own songs in your head?,"yes, mainly while i'm working on it."
How long did it take to make your latest video?,
Where do you edit ur vids?,
what is your opinion ? ;)?,
why didn't you answer me?,
I think people are super frustrated about you not monetizing your content because if they were in your place they would've most definitely. Maybe you should make your patreon more accessible than other other categories?,maybe i put it exactly where i want it.
how long did your last video take to make?,
is love evil?,i doubt it.
"why dont you upload vid more frequently? it's so funny,thank you,dude. :)?",i am making them as fast as i can.
can you explain what your scramble page is? i don't understand what you are doing with the phrases?,anagrams. it's when you rearrange the letters.
let's go sailing in the bermuda triangle?,"ah, that sounds wonderful."
Can an artificial intelligence be considered a person?,"when it gets good enough to be considered a person, it would no longer be called artificial."
have you ever regretted answering something?,yes.
"Would you leave Earth given the chance, or is Earth too cool?","maybe if there was another inhabitable planet, with similar amenities, breathable air, etc."
is the time next to a question on the questions page the time the question was asked or the time you answered the question?,
"do you separate your personal life (friends, relationships, fun) from your work?",they are the same.
why wont u answer any of my questions buttface?,
What time is it when you answer this question?,5:08 pm.
is this a good question?,
is there even an answer to this question?,yes.
What do you have against capitalizing stuff?,nothing.
"Did you not earn anything from the history of entire world, because it didn't have any ads?","i don't earn anything in that way, but i earn from it in other ways."
did you notice that most people here are now asking questions in lower case because you rarely use uppercase?,people have always used capitals and lowercase in their questions.
"of course, you could continue doing videos you wanna do?","yes, but much slower."
i would hypotethically pay you thousands of dollars per video?,
Are you really aware of everything you're doing?,yes.
"how do you remember if you've answered a question similar to the one asked, for you to link the question to the page with other similar questions?",
chicken or egg?,
"if no, what kind of copyright do you have for your stuff if you thought about that?",.
what are some good things made of wood?,trees.
how do i know if i truly love somebody?,you just have to guess.
is the earth flat?,it depends how you look at it.
"have you figured out what people mean when they ask _____ or ______? yet? if not, i wish you the best of luck?",.
"it is very helpful for me to discuss these kinds of things at length with somebody who thinks on the same wavelength as me, but has their own point of view?",that sounds wonderful.
do u get hype about stuff?,oh hell yeah.
Get well soon friend?,i already am well.
why are the hyperlinks green? green is not a creative colour?,i thought it was a reasonably good fit with the other colors on this page.
do you ever sleep?,
why am i here?,where.
why do you make videos?,
is a question really a question if there's no question mark?,
how to get more friends?,
what are you gonna do now after history of the entire world? i guess?,
What is your favorite meme ever?,
is time an illusion?,"if it is, then everything is an illusion, in which case we should probably have a simpler word than illusion for what everything is, perhaps not even use a word at all."
"to the person who requested you make a favicon: there are browser extensions that let you choose a favicon for any page (and can include any/all pages on that domain), just google search for your browser + favicon changer or tab edit and you should find one. so that way they can choose any favicon they wanted to, even for the entire site. and it might help them out if there are other sites they visit without a favicon?","ah, nice."
would you ever come to australia? also why didnt you include much of australia in hotewig??? also i love u?,
"For your next music video, will you make it comedic or rather serious? because i love your music style, and i wonder if you'll ever make a serious song?",i'm not sure i know how to make the distinction.
is the moon made of cheese?,i don't think so.
why is :0000000 on the hotewig.html page? i hope you know what i mean?,that was the first question reacting to the release of the video.
WHATS YOUR FAVORITE IDEA mine is to think creatively?,"ah, that's a great idea."
If you could any sort of cutlery what would you be? (I'd be a spoon)?,
what should i paint?,
vacationing in the center of the earth isn't on expert mode.Plz fix?,.
I think I've finally found a cluster you hadn't used. AMaj7add4omit5/G# . (G# C# D A)?,"you may be right, although i probably came really close to using something like that somewhere around either broke again or sike."
how do i have more ideas?,everything is an idea.
did you get your youtube plaques yet?,no.
how many cubic centimeters are in a cubic meter?,a million.
Why do you always comment: oh hell yeah. Just wondering :p?,i don't. i only say that to things i strongly agree with.
did u title hotewig just because of its shortened name?,"hotewig is just an abbreviation for history of the entire world, i guess. i haven't really used it anywhere, except for file names."
"why do we call it the moon, when there's more moons?",because that was the first one we knew about. and also the only one we have at our planet (i think).
"If I forget the question mark, does it still count?",
did you ever decide to go on an adventure somewhere all alone?,.
and if so do you have any advice? asking for a friend?,"do the adventure, unless you don't think you want to."
what if everything was spiders?,i think everything is spiders.
what's your favorite table?,time.
"do you ever feel insecure about how you appear and come across to others, and if so how do you deal with that?",it's kind of like a water slide. just try to keep moving forward.
"why did you have to make the history of the world video? (thank you tho, i love it and it was great and fantastic and thank you)?",it seemed like a good idea at the time.
can you make your next song 1 minute and 42 seconds? thanks?,i will see what i can do.
Do you not like answering silly questions?,"no, i don't not."
do you sometimes like to think of yourself not as a person but as a conduit through which the universe can do Kool Tricks?,oh hell yeah.
Do you answer questions?,oh hell yeah.
"thank you for not using ads. i don't get why people give you shit for not using ads. the same people probably complain when they get ads on tv and shit so what's the big deal with no ads. but thank you for no ads, if i were to see one more goddamn amazon or some shit pop up ad id probably throw my phone out of a window?",i know what you mean.
