question,answer
How does one figure out the time signature of a song? I know what time signatures are but I have no idea how to figure them out in songs that are more than just like one instrument (so most songs)?,"step 1 is, find the beat. so as the music is going, see where you would tap your foot or nod your head, or wave your conducting wand. in most songs, this is pretty easy to find. of course you could always make crazy songs where you can't find it, but in Most songs you can find it. however, in most songs you can also do it twice as slow (or half as fast) if you want. in some songs, it is at just a certain tempo that you're almost not sure whether to tap the beat at one speed or twice as fast. this is ok, any piece of music can be written in multiple ways, you could set the tempo twice as fast and write all the notes as half the values and it would mean the same thing. but in most songs, it is reasonably clear where the foot-tap is. and i will go a step further to say that most music usually has these beats grouped together in groups of 2, 4, 8, etc. the way most music is written on paper is in groups of 4 beats, with bar lines dividing the bars (or 'measures'). most music uses 4 beats per bar. that being said it is really up to you to decide where the begining of the bars should be. but i think in most music there is a clear answer. to learn how to detect other time signatures besides 4/4, just start finding examples of them and then you will get better at hearing them. but when songs use 3-based time signatures, it can often be represented in multiple ways, many of which actually still heavily involve 4s. 2s, 3s, and 4s, are used all the time in music. it is very rare that music consistently uses a 5 or 7 pattern all the way through. usually when time signatures like 5 or 7 happen, it tends to be only once, and then goes back to 4. it is quite common for songs to need to add an extra beat or half a beat here and there, particularly at the end of the chorus or at the end of a section. this is accomplished by having 1 bar that is a different time signature. it is much more rare to have a song that entirely is based on a 5 pattern or a 7 pattern or another higher odd number. i'm not sure if that answers your question actually, but i think my most important point is that most music is in groups of 2, 4, and 8. and the way that is most commonly written on paper is with 4 beats per bar, and the time signature is called 4/4 (actually the first number is written above the second number but that's not easy to type here) the top or first number represents how many beats per bar. the bottom (or second) number is supposed to tell you what kind of a note gets the beat. so 4/4 should technically mean there are 4 beats in a bar and a 'quarter' note gets 1 beat. i realize there are holes in this system and many time signatures really can't be analyzed quite this way but that is the way the idea is supposed to work."
did you make the history of the entire world video bc people were asking you to make videos about other countries historys after you made the japan history video?,no.
why am i depressed?,because everything is too normal.
how do i become art?,you surely already are.
why is the ask box on the random question page too?,"in case you want to ask a question, when reading the questions."
"hi bill, big fan. tomorrow im starting my senior year of highschool and i got the jitters. can you give me some advice for getting past this anxiety?",wear a type of clothing that no one else has ever worn before in the history of the earth.
"Hey Bill, I've been playing guitar for a while and I've been improvising over songs by finding the key it's in and playing notes from the pentatonic scale over it. I know you're a big proponent of not doing that, so I was wondering, what would you suggest I could do instead or as a next step to improve my playing/improvising? Thanks my man?",try to do something that would make you the star of the show.
also did you employ a similar documentation procedure for hoj?,yes.
why do you use capital letters?,to help express myself.
"if compound time signatures have a multiple of three at the top,?",actually they usually don't. but the top number tends to be an odd number.
how come 3/8 isn't compound\/\?,it's not really big enough to split. that would be like splitting a grape to share with a friend.
Do people still give you a hard time about not posting videos?,"yes, which is ironic, because all i do is make stuff and post it."
What do you think about trees?,i think they are doing a great job.
would u ever release the memos for the songs you've written since you stopped writing songs on paper?,yes. i think it would be nice to put together behind-the-scenes videos for songs and videos.
i feel like you mentioned wanting to do that in either the notebook or reality. that would be cool?,
what were you doing a year ago (11 August 2016)?,"working on the writing and research for history of the entire world, i guess."
what was the point in the do you ever have sex? line in movie star? it seemed out of place?,to keep it interesting.
Is this kind of question asked frequently enough that it gets a green link?,
Sorry if this was asked before?,
why are you not answering my very serious waluigi questions? waaaaaaaaaaaah?,"i did answer them, but i respect your opinion."
"rate waluigi. review him, give him a score out of 10. break your rules for waluigi. say he's your favorite. people will go fucking bananas. i wanna start some shit?",0.
did you sample waluigi's voice in the song movie star? i think i heard it in there?,not unless you play it backwards.
do you think waluigi has pointed feet or just wears pointed shoes for the hell of it. this kind of thing is usually a no brainer but this is waluigi we're talking about?,his feet are shoes.
how inspired are you by waluigi?,not at all.
how influenced are you by waluigi?,not at all.
whens the waluigi?,i accidentally put the schedule through the paper shredder.
is there a waluigi?,i'm not sure.
why are you so obsessed with waluigi?,i am not but i respect your opinion.
whats the appeal of waluigi to you?,nothing.
is waluigi important to you?,no.
do you ever think waluigi?,no.
is there any hidden waluigi in your music?,i will check.
how do i make music?,"freely, with a sense of adventure, and mischief."
also how do i make waluigi?,think of a great idea for a character and then get amnesia.
are there any particular waluigi quotes you like?,"oh shit we need another character, let's see if the janitor has any ideas."
are you an expert in waluigi?,no.
how might one become an expert in waluigi?,study abroad.
is waluigi the type of thing youre into?,not per se.
might i recommend the waluigi?,that sounds wonderful.
care for a waluigi?,not at this time.
how do you like your waluigi?,i do not.
how much of your year is spent thinking about waluigi?,about 0%.
are you ever going to make history of waluigi?,no.
whos your favorite waluigi?,"there is only one, although next year nintendo is coming out with 12 new characters which will be additional combinations of mario, wario, and luigi."
are you familiar with waluigi?,a little bit.
how intrigued are you by waluigi?,not very much.
are you pro or anti waluigi?,i don't think i'm legally allowed to say.
tell me a little about waluigi?,i have already said way too much.
could i get your opinion on waluigi?,not right now.
thoughts on waluigi?,not at this time.
how fascinated are you by waluigi?,not very.
how interested are you in waluigi?,not very.
would the bill wurtz band ideally have every single instrument because theyre all good because everything's good because everything's bad?,i think that would be too many instruments for one band.
what are you sure of?,i can't tell you.
i just wanna get shit DONE?,i know what you mean.
i am pie?,hi.
how to eat ricecake?,try a way that no one has tried before.
Do you think?,yes.
"how often do you get questions,?",every moment.
how do we know this is a real user-submitted questions page and not (filter research) just you writing enjoyable questions for you to answer yourself?,
"advice, on what to do on the first day of school once i locate and enter the establishment? i think i already have down the basics like finding classes and learning stuff?",wear a type of clothing that no one else has ever worn before in the history of the earth.
wait are you actually from cuba? or of cuban heritage? or are you a cube?,"no, i am mark."
what is your favourite type of ceiling?,floor.
What is something that makes you happy?,all the possibilities.
what is this?,the questions page.
die?,wait hold on i have more stuff to do.
"What's your vocal range? I go from Eb2 to D4, falsetto to maybe E5?","as far as i know, there is no system of octave numbering that is univerally agreed upon. so i don't actually know for sure which notes you mean."
i was looking through the code and it is badly written(but works). just a question?,and an insult.
And if something is nothing?,nothing is nothing.
Why is the english language so weird?,"because it is a combination of many different languages and dialects. i think actually most languages are born this way, and most languages are in that sense 'weird' which is normal."
"Like how a Normal C major chord differs from those chords where you play C, F, A?",.
Thank you so much for the help! I'm having lots of fun reading the answers you give people on tips to play?,
When are you going to add subtitles to your videos?,"i would prefer to re-edit the entire video. there are words all over the screen in most of my videos, so it would be important to re-do the visual and the audio entirely."
"hey, bill, i dont even know how to properly write in english, or even speak, to be honest, but i'm really afraid i'll never succed at doing art related stuff, its something that its always on the back of my mind keeping me from doing more stuff?",everyone who has ever succeeded has had moments like that. and they moved forward anyway. just because there is dirt and mud everywhere doesn't mean you can't drive right through it on your dirt/mud bike.
"I dont understand how people identify time signatures in almost all music (pop, rock, jazz, etc, etc). I play classical music,?",i think it's the same.
"I have the opportunity to submit a name for a new elementary school, what would you name it?","i would have to be familiar with the school, as well as its properties, and charicteristics."
"i really need you to get in touch with me, please answer my mail?",.
"i sent you a mail, please check, i need an answer even if it's negative?",which one was yours.
however i do know that you live there?,are you sure.
is there anything you don't like?,disliking stuff.
why are mailboxes blue?,why wouldn't they be.
how has the passage of time influenced you?,it allows me to move and change.
and did you figure out where it goes?,"the time is not what goes places. it's everything that goes places, and the time allows it to."
You don't like Roman numerals(8.7.176:42 pm)?,.
":0 woah. What do you call a I,IV,V?","1, 4, 5 (by the way this is off the subject but if you are talking about a 4 bar chord sequence, in my opinion you really need to list all 4 bars, indicating which chord is doubled. such as 1, 1, 4, 5 or 1, 4, 5, 5. there is a huge difference depending on the timing, and if no timing is otherwise listed, just simply saying 1, 4, 5 (or I,IV,V) leaves me feeling still 100% left out of what is actually going on, with a 95% suspicion that it is actually referring to one of the two aforementioned 4-bar sequences, and being completely unable to determine which)."
what is the difference between person and human?,i think person means whatever you are. human is just what you happen to be.
all your asnwers are only one sentence long! Why_?,"they are not, but i respect your opinion."
"a professor told me a 7/13 voiced 7 1 2 3 6 was a cluster, cause of the tone to tone intervals. But it doesn't sound clustery to me?",i suppose the famous proverb applies here: one person's cluster is another person's non-cluster.
chords where I can use the whole tone scale (besides #11 and b13 chords?)?,a whole tone scale will generally work best over chords that only contain notes from that whole tone scale.
something to do with the teachers/teaching methods?,i am self taught.
do you think that rock music sounds powerful cause of the paralel fifths and octaves in power chords? Oh only now i see the irony of my question?,rock music' could mean a hundred million different things. i think it could mean even more things than there are songs to represent all those thing.
"Bill, i get that everything has its unique qualities and flaws, but don't you think some things have more unique qualities than others? (quality being something completely personal and intimate)?",i think everything surely has infinite qualities. a 'quality' sounds like something only a human could be in the mood to see.
ive noticed a big difference between the Cs. they all sound the same but some are higher the same and some are lower the same. you can even play them at the same time and they cooperate very well. next step please?,"go to the middle of the keyboard. take every white note from C to the next C. so that should be 8 notes (c, d, e, f, g, a, b, c). Now, see what songs you can play! just using those notes. hint: start with like popular kids songs."
"Do you set aside a block of time to work each day (ex. 9am-5pm) since this is like your job? or, since it involves a lot of creativity (which doesn't adhere to a specific timeframe) do you find yourself jumping up with inspiration and going to work right away in lots of random bursts so as to not forget something that could end up being pretty cool? sorry for my english?","there is more work to be done than could ever be done. therefore, i work as much as possible."
whenever anyone posts one of your videos on reddit and the topic gets to donating to you there's always someone that says that you sent their paypal money back. why would this be?,"i don't know. i've talked to customer support, and they said they can't look into it unless i know the email/info of the person it happened to. i've tried to contact some of those people on youtube but i have never heard from anyone directly with this problem. so i can't prove to customer support that it's happening. i think it mainly happens on international currencies, but i'm not sure."
what is a bandicoot?,i have no idea.
do you still have a bad car?,it's worse.
how are computers random. it doesn't make any sense. they run programs that always do a thing in the same way every time but sometimes the object is to not do the same thing every time?,"i think the most basic way is to some how derive it from the time asked. for example if you put the smallest possible unit of time into mod10, and then spit out the digit (0-9) corresponding to the exact moment you requested something random, then i think that's pretty random. you really never manipulate it, unless you used another computer."
a while ago i think you said that you didn't think you had a video on your channel called africa?,i never said that.
are you gonna go to mars?,not until there is more stuff there.
do you have a youtube channel?,yes.
why are doors so important?,because they allow you to walk through walls.
how long does it take to make videos such as your music videos?,which one.
How to believe in North Korea's religion?,step one is you have to like that one guy.
I AM A STEGOSAURUS?,i know what you mean.
"If you call here a question a ueqstion,?",which i do not.
"what is the true meaning of the hi, I'm steve song? (THE 2 SONGS)?","the meaning of both songs is that putting music in a video can be nice. a hidden meaning is that music in videos is actually SO powerful that it makes the audience become attached to whatever music in the video, and demand a 'full verion' of it, regardless of how much better (and/or 'full') music i have already done without videos."
describe yourself in one word?,ok.
Do you ever just uuuggghhhhhhhhhhhhhhh?,sometimes.
i want to study opera what di you thunk?,seems legit.
will there ever be anything added to reality again? asking for a friend?,yes.
"i just. i love it when picked or plucked strings sound SOAPY. you can hear it on a bright acoustic guitar but... even more on a banjo or mandolin. there's something about the satisfying, slippery but solid texture of that sound that makes me think of soap. even dragging a pick across a string sounds like what it feels like to run your fingernail over a bar of soap. all the little stops and starts. mmmm. yummy right?","oh damn, you are special."
What the hell i'm supposed to do here ? I'm confused and that make me sad?,"read questions, ask a question, etc. that sort of thing."
do you like to surf? by surfing i mean like riding the waves of thoughts and emotions?,oh hell yeah.
"let me amend what i was worried about with the whole individuals thing. to be an individual i think is SUPER IMPORTANT AND MEANINGFUL!!!! but most of life's positions and jobs and stations are devoid of any respect for individuality. people are treated as assets, machines. i think most people just loan out their time in life as Unique people in order to have money, for living. that's AWFUL. i want to do so much, i dont want to be a machine. but am i really so different from most people? why do i deserve to escape the fate most are consigned to?","this particular world has a competitive nature to it. i don't really know why it is that way, but it is. everyone is unique. but you need to fight for your uniqueness. and also try being even more unique, and fighting even harder."
"what are your thoughts on bass guitar as an instrument, what it should contribute to a song etc?","you'll just have to try it with and without, and see for yourself."
how do i make lentils interesting?,you will have to think outside the bean.
Whats your favorite angle ? Mines 76 degrees?,"it depends what direction i am going, and what direction i'm trying to go. and specifically, the difference."
what should I do if I'm depressed all the time and everything seems to be hopeless?,.
"please do a video of got to know whats going on next!! i know, an entirely new piece would be great too and everyone would enjoy the shit out of it. i just really feel like that song needs a video. no, it deserves a video. im scared that if you do the new thing, theres not gonna be a video.im only writing this because you seem unsure of your next step. it probably won't matter in the end?","at this point, i have fully re-realized the importance of doing videos for songs. this is clearly illustrated in the fact that everyone thinks that movie star is a brand new song, everyone wants longer versions of the steve songs, and hardly anyone has heard of 'got to know what's going on.' most people never heard of movie star before the video. it is common knowledge that videos are vitally important for song publicity, and i have known this for a long time, but earlier this year i was hooked on the idea that i could do them without videos, for a simple reason which is that i can do songs about 4 times faster if i skip the video. this is a tempting strategy, but as i said i'm currently back in the viewpoint that videos are needed. what i'm trying to say is, i highly doubt that my next project will be a videoless song. it might be a new song together with a video, or it might be something completely different."
if two witches were watching two watches which witch would watch which watch?,each which would watch one watch. then they should switch.
is nine nine or is nine ten?,i will check.
what do you think of this chord progression:Eb Bb Db Ab Bmaj7?,"in order for that to have any meaning, you will need to specify the timing-- how long each of the chords last. then, you really need to specify specifically how they are voiced, which notes you used in which octave. you didn't even tell me whether it loops. that's 5 chords, so unless it's a weird time signature there must be some that are a different length. unless it does not loop in which case again you need to specify the timing. then still, you need to specify how it's played rhythmically and what kind of tone. and all that still means nothing if i don't know what the melody is, and even still, the over all effect can still be influenced by what the lyrics are. even still, with all that information written down on paper, there are still worlds of sonic factors that can give it a vastly different sounding result, even after nailing down the full notation, tempo, melody, and lyric. that being said, i think it's fine. everything is fine."
do you remember the thrill of the first time you heard/noticed a specific interval in a song? (like for instance i remember when i was little and first noticed that 7th and 9th in a final chord of a blues song)?,"i remember at a young age figuring out if youre in the key of C and youre about go to F, sneak a Bb note into the mix (in other words play C7) right before you go. it will get everyone in the room ready and eager for the trip."
why did you stop making notes at 12.17.16?,"that's not when i stopped, but why haven't you made any."
how many numbers are in the number 1000?,it depends how you look at it.
how many of the questions people ask here do you actually answer?,you wanna check.
is learning things fun?,oh hell yeah.
"If we could somehow quantify the act of being reasonable,?",which i think is completely impossible.
"I.e. if you're being completely unreasonable, you're operating at 0 Wurtz, but if you're super reasonable, that's maybe 6 Wurtz. I estimate you are at a level of about 7.9 Wurtz so I doubt we can go higher. Also it's logarithm like the Richter scale so every increment of 1 Wurtz is 10 times more reasonable than the last Wurtz (e.g. 5 Wurtz is 100 times more reasonable than 3 Wurtz)?",
"what is the true meaning of the hi, I'm steve song?",there are 2 songs in that video.
how do you overcome mediocrity?,try rotating it.
"When im in the random question page (accessed by the im feeling lucky button), there's a new random question button, but refreshing the page does the same thing. Why add a button instead of just writing somethinf like refresh for a new random question or, in bill wurtz style, ive added a button to your keyboard that serves you a new random question. Ive named it F5. Click it for a new random question?","i think your solution is nice, but much much too complicated."
"if so, what do you do againts cloudy mind?(my mind just got unclouded, today. but i dont know how i did it)?","sometimes you have to just try every type of thing, and it still doesn't work, for years and years. until one day you get so desperate that you just pull the fire alarm or something, kind of like."
"bill, are you there?",where.
"when you inevitably perform in california live will you replace one of the states (west virginia, minnesota, colorado, etc) with the name of the state you're in or do you find that too kitschy?",i've never thought about it. i would do it if the state has 3 syllables. that would be a nice challenge to try to find a way to say each location in a way that fits rhythmically.
"you often give advice to wannabee musicians to just play around, use notes and combine them in different ways and it comes across as thats how you got to where you are. But it's obvious from this page that your actual music knowledge is vast and that you didnt stick to messing around and actually took some serious time to study music and music history, get acquainted with various styles including classical and jazz and also you even revealed that you actually had some formal tutoring/training as well (7.13.17 11:58 am). Isn't it a little disingenious to just say to people to mess around with music when there's so much more to music than that? Sorry if it sounds like an accusatory question, i dont mean anything bad by it. Just feel like youre underselling how much work one has to put in to be bill wurtz or jay z or bono or whoever?","over and over and over again, people talk about learning music like it's something that someone else has to give to you, or like it's something that someone else can just make you do. that's just not how it worked for me. sure, there is a lot of language for music, like knowing the note names, even knowing what the common industry names are for chords. but that information is all out there readily available ESPECIALLY now with the internet. the only way any of that information is going to make sense is if you actually try it out. and when you are ready to learn what things are called, i think you will find that the information will be readily available. i will also readily provide that information as well. like for example, if anyone asks me what any note is called, or if anyone says is there a special name for when you play C, Eb, and G at the same time, i will readily and gladly say that's a C minor chord. but if someone asks 'how to use theory to get music to sound good', i will explain again and again and again that the way to do this, and the way to learn how to do it, is by using your own experience, your own mind, your own hands, and your own ears, otherwise you're just not going to get the good stuff. i will keep trying to explain this to people until the apocolypse, maybe even after that."
i feel like the 'ask' button should have a cool color scheme like the randy button. please do it mr. wurtz?,i prefer to keep it simple. please don't call me mr. wurtz.
describe yourself in three words?,doesn't describe self.
bill can i call you bill?,sure.
bill do you hate jews or do you love them?,what i think about a person is not affected by whether or not they are jewish.
